2018-03-24,"Currencies are just the start for blockchain, we have to remember that. Bitcoin created decentralized trust. (thedistributedpost.com)",Interactive Bitcoin Sculpture at The Atlanta Tech Village (i.redd.it),How To Transfer Bitcoin From Coinbase To Your Own Wallet (youtube.com),"Found a great Merchant that accept bitcoin for flights, hotels, and touristic events called Future Travels as I traveled only using Bitcoin directly. A great Alternative to Expedia in the US, Cheapair, with quicker confirmation time as they use the platform tinkl.it for payments. (youtu.be)",Roadmap for bitcoin - Andreas Antonopoulos (youtube.com),Slush Pool mined the first block using overt AsicBoost! Halong Mining is real! (twitter.com),I found one of us in the wild! (i.redd.it),"Malta's prime minister is personally welcoming cryptocurrency exchange Binance to the country. Finally, crypto exchanges are getting proper support and banking services. (twitter.com)",Bank Accounts Could Disappear - Deutsche Bank (uk.businessinsider.com),Binance News: Binance Ready To Capture The Coinbase’s Crypto Market Share. (twitter.com),Healthcare Is Aching for Solutions: Is Blockchain The Answer? (medium.com),BITCOIN EXPLAINED. Gold back in 700BC was no different... (youtube.com),Tipping on Lightning with the Nanotip LApp (blockstream.com),"The NSA Worked to “Track Down” Bitcoin Users, Snowden Documents Reveal (theintercept.com)","Trade war with China could be bad for dollar, good for bitcoin (self.Bitcoin)",How bitcoin became popular in my company because of a missing payment terminal (self.Bitcoin),It is a matter of time before banks embrace bitcoin (self.Bitcoin),"Daily Discussion, March 24, 2018 (self.Bitcoin)",IT Ministry of China Likes Blockchain (alextones.com),"“Real Users"": Bitcoin Donations Helped These Earthquake Survivors Recover (bitcoinmagazine.com)","We're excited to reveal our next #LApp for @Blockstream's #WeekofLApps: #LightningPublisher for @WordPress is a plug-in that lets content creators, businesses, or anyone with a WP site to accept $BTC payments instantly via the #LightningNetwork (twitter.com)",WordPress websites can now accept instant Bitcoin payments: thanks to Blockstream (blockmanity.com),Vertcoin Developer Proposes Hardware Device for Lightning Network (btcmanager.com),"@lopp with a kick-ass ELI5 of Bitcoin in one sentence: ""Bitcoin is a game where everybody watches everybody else to make sure nobody cheats."" (twitter.com)","PSA: Only about 26% of full nodes are on 0.16.0. If you have a full node, this is your reminder to update it. (bitnodes.earn.com)",Found a text exchange from 2013 I had. I wanna cry and punch my 2013 self :( (i.redd.it),
2018-03-25,I created a site for people to find their closest Bitcoin ATM in Australia (findbitcoinatm.com.au),First purchase with bitcoin. (self.Bitcoin),Bitcoin's Next Year in Tech Development Is Coming into Focus (coindesk.com),"Send $10,000 for 1 Cent: Bitcoin Transaction Fees Hit 'Unfairly Cheap' Levels (bitcoinist.com)","Analyst who predicted bitcoin’s rise now sees it hitting $300,000-$400,000 (blog.unocoin.com)","Tomorrow, March 26, the shit hits the fan for the US Dollar. Look for a bump in BTC adoption as a store of value (youtu.be)","""Worry not! Cash is as valuable as you believe it is!"" Our latest satirical propaganda-style art; thought you all would enjoy seeing it! (i.redd.it)",You’re still up over 250% if you listened to “Bitcoin Sign Guy” <-- Shows how far we have come from last year (goldtelegraph.com),The 4th LApp - paypercall !!! (twitter.com),Use bitcoin to hedge fears of losses during a trade war: Bitcoin bull Brian Kelly on CNBC (cnbc.com),"Daily Discussion, March 26, 2018 (self.Bitcoin)",Bitcoin transaction fees are at the lowest levels since May 2017. (self.Bitcoin),The many traditions of non-governmental money (part i) - Nick Szabo (new blog post) (unenumerated.blogspot.co.uk),"⚡ Hackers tried to steal funds from a Lightning channel, just to end up losing theirs as the penalty system worked as expected (twitter.com)",Peter Theil on why the growth of cyptocurrencies is not the same as the dotcom bubble (self.Bitcoin),These cryptic artworks hide a Bitcoin fortune - all you have to do is decode them. (sciencealert.com),"misleadingBitcoin is digital gold and the LightningNetwork uses cryptographically secured and trustless “IOU’s” as a medium of exchange backed by bitcoin, for efficiency. Like when paper money was backed by gold in 1844. But this time no one can suddenly take the gold away. (self.Bitcoin)",Idea for increasing adoption - Calculated group effort. (self.Bitcoin),Paypercall Shows the Full Power of Lightning Charge (blockstream.com),TIL You can permanently close somebodies citibank account with a small transaction that mentions bitcoin :-) (self.Bitcoin),"Opinion: Despite Recent Woes, Bitcoin Could Hit $30,000 This Year (hacked.com)",Reminder: Encrypt and store your bitcoin offline - U.S. Congress Quietly Passes CLOUD Act to Increase Gov't Access to Online Info (bitcoinist.com),"I sent 0.3 BTC with a fee of 0.00005 BTC, got confirmed within 4 minutes. (Both Segwit Wallets). (self.Bitcoin)",92% of Millennials Don't Trust Banks (v.redd.it),This cryptocurrency miner is growing 'cryptomatoes' using excess heat from his computer setup (cnbc.com),BTC.COM has 31% of Hashrate on the network right now (self.Bitcoin),"French Finance Minister Reverses Course, Turns Bullish on Cryptocurrencies (ccn.com)"
2018-03-26,I created a site for people to find their closest Bitcoin ATM in Australia (findbitcoinatm.com.au),First purchase with bitcoin. (self.Bitcoin),Bitcoin's Next Year in Tech Development Is Coming into Focus (coindesk.com),"Send $10,000 for 1 Cent: Bitcoin Transaction Fees Hit 'Unfairly Cheap' Levels (bitcoinist.com)","Analyst who predicted bitcoin’s rise now sees it hitting $300,000-$400,000 (blog.unocoin.com)","Tomorrow, March 26, the shit hits the fan for the US Dollar. Look for a bump in BTC adoption as a store of value (youtu.be)","""Worry not! Cash is as valuable as you believe it is!"" Our latest satirical propaganda-style art; thought you all would enjoy seeing it! (i.redd.it)",You’re still up over 250% if you listened to “Bitcoin Sign Guy” <-- Shows how far we have come from last year (goldtelegraph.com),The 4th LApp - paypercall !!! (twitter.com),Use bitcoin to hedge fears of losses during a trade war: Bitcoin bull Brian Kelly on CNBC (cnbc.com),"Daily Discussion, March 26, 2018 (self.Bitcoin)",Bitcoin transaction fees are at the lowest levels since May 2017. (self.Bitcoin),The many traditions of non-governmental money (part i) - Nick Szabo (new blog post) (unenumerated.blogspot.co.uk),"⚡ Hackers tried to steal funds from a Lightning channel, just to end up losing theirs as the penalty system worked as expected (twitter.com)",Peter Theil on why the growth of cyptocurrencies is not the same as the dotcom bubble (self.Bitcoin),These cryptic artworks hide a Bitcoin fortune - all you have to do is decode them. (sciencealert.com),"misleadingBitcoin is digital gold and the LightningNetwork uses cryptographically secured and trustless “IOU’s” as a medium of exchange backed by bitcoin, for efficiency. Like when paper money was backed by gold in 1844. But this time no one can suddenly take the gold away. (self.Bitcoin)",Idea for increasing adoption - Calculated group effort. (self.Bitcoin),Paypercall Shows the Full Power of Lightning Charge (blockstream.com),TIL You can permanently close somebodies citibank account with a small transaction that mentions bitcoin :-) (self.Bitcoin),"Opinion: Despite Recent Woes, Bitcoin Could Hit $30,000 This Year (hacked.com)",Reminder: Encrypt and store your bitcoin offline - U.S. Congress Quietly Passes CLOUD Act to Increase Gov't Access to Online Info (bitcoinist.com),"I sent 0.3 BTC with a fee of 0.00005 BTC, got confirmed within 4 minutes. (Both Segwit Wallets). (self.Bitcoin)",92% of Millennials Don't Trust Banks (v.redd.it),This cryptocurrency miner is growing 'cryptomatoes' using excess heat from his computer setup (cnbc.com),BTC.COM has 31% of Hashrate on the network right now (self.Bitcoin),"French Finance Minister Reverses Course, Turns Bullish on Cryptocurrencies (ccn.com)"
2018-03-27,How Businesses Can Accept Bitcoin [Step-By-Step Guide] (usethebitcoin.com),My wife and I bought Bitcoin for our 2 year old daughter. [Excited] (self.Bitcoin),PSA: Lightning Network node count has exceeded Bcash node count. (self.Bitcoin),Sunny and Stormy Days in Lightning Network (tokenthusiast.com),Bringing Bitcoin (Lightning supported!) to Streamers With CoinTippy (medium.com),Bitrefill's node now has over 1 bitcoin of capacity on lightning. ⚡️ (twitter.com),It’s Too Late — Nothing Can Stop The Bitcoin Protocol (decentralize.today),Today it's Ross Ulbricht's 5th birthday spent in prison. Happy Birthday Ross! Keep fighting for justice!!! (freeross.org),A BIG Bitcoin Billboard in Downtown Toronto looks great! (twitter.com),Why Trade Wars will PUSH Bitcoin to 100k! (youtube.com),Day 6 LApp: Ifpaytt Brings Lightning Micropayments to IFTTT (blockstream.com),Bitify Now Looks Like a Darkweb Marketplace (coinjournal.net),21% of students surveyed admit to spending financial aid money to buy cryptos (studentloans.net),"Regulators & bankers in a few years: ""the Lightning Network is not interesting, although the Hashed Time-Lock Contract technology has a great potential"" (self.Bitcoin)",The many traditions of non-governmental money (part i) - Nick Szabo (new blog post) (unenumerated.blogspot.co.uk),A Look At Blockstream's Lightning Charge Applications (coinjournal.net),Today exactly 100 days ago Bitcoin reached it’s current ATH and dropped 60% in value since (athcoinindex.com),"Global Blockchain Forum April 2-3, 2018 (global-blockchain-forum.webflow.io)","Creator of Zap! LN Wallet, posted this on twitter (twitter.com)",Who Is Elizabeth Stark - a Bolt of Lightning!? (unblock.net),"Demand for Bitcoin in Venezuela continues to rise, amidst economic turmoil (bitcoin.net.do)","Daily Discussion, March 27, 2018 (self.Bitcoin)","Bithumb To Support Crypto Payments At 6,000 South Korean Stores (cryptoglobe.com)",Quiet times are the best (twitter.com),3 Most Promising Bitcoin Improvement Proposals (BIPs) (decentralpost.com),"Hal Finney, while paralyzed by ALS, wrote code for a bitcoin wallet using only his eyes (self.Bitcoin)",Reddit quietly drops Bitcoin support... will no longer allow users to purchase Reddit Gold with Bitcoin (themerkle.com)
2018-03-28,Electrum 3.1.2 release! (electrum.org),"Daily Discussion, March 28, 2018 (self.Bitcoin)",Circle Invest is now live for NY State residents. Which means they have successfully required a Bit license!! (COINBASE COMPETITOR) (self.Bitcoin),A look at the 6 LApps introduced by Blockstream.. (blockmanity.com),I have a feeling that soon we will see the real crypto wealth transfer from tons of shitcoins into the King Bitcoin. (self.Bitcoin),Abra CEO Predicts Bitcoin Price Boom Will Return This Year (bitcoin-casino-reviews.com),Failed Predictions; adding Bitcoin to the list (i.redd.it),Blockstream: The Lightning Jukebox Offers a Fun End to Our Week of LApps. I agree (blockstream.com),Today is my birthday and I just wanted to say thank you... (self.Bitcoin),I am convinced that our sons now have the most up to date toy cash register in the world 😁 It's never to early to learn crypto... (i.redd.it),"Anyone in Phoenix, please come to the US federal courthouse room 602 to listen to closing arguments (3/28/2018) on Localbitcoin trader Morpheus (Washington and 4th Avenue.) - Please share wide (twitter.com)",Newegg Extends Bitcoin Payment Option to Canada (businesswire.com),Acinq Releases Eclair Lightning Wallet Beta on Mainnet (twitter.com),1000 lightning network nodes on mainnet! (self.Bitcoin),SegWit is now live in Coinomi Wallet (twitter.com),"Bitcoin Adoption is Real: From Purchasing Real Estate, Sports Cars and Lawyers and Billboards all over the place! (goldtelegraph.com)",Delicious Proof that Roger Employs Sockpuppets! (self.Bitcoin),Millennials Prefer To Invest In Bitcoin Over Any Other Cryptocurrency (cointrust.com),CBOE Answers SEC Concerns Over Bitcoin ETFs (bitcoinist.com),Blockstream Overdelivers with Lightning Network: 7 Days in a Week for 7 LApps (tokenthusiast.com),"Tom Lee on CNBC Fast Money March 28, 2018 (youtube.com)",Just started using the decentralised exchange BISQ (self.Bitcoin),"I just donated someone 6 cents and paid 0,00012 USD fee... with lightning! (self.Bitcoin)",Bitcoin's popularity in Africa continues to soar. This was the whole idea behind bitcoin and crypto - economic freedom. Not get rich quick scheme. (decentralpost.com),Blockstream releases 6 Bitcoin Lightning apps in 6 days...the final one will be released today (blockmanity.com),"Hal Finney, while paralyzed by ALS, wrote code for a bitcoin wallet using only his eyes (self.Bitcoin)",
2018-03-29,First beta of LightningTip (for websites) (twitter.com),Sold part in Dec & Jan. Buying now. Let's see how i do in 30 days (self.Bitcoin),History repeats itself (self.Bitcoin),Yahoo Japan to open cryptocurrency exchange- Nikkei Asian Review (asia.nikkei.com),Banned from r/btc simply for stating a verifiable fact. That r/btc has not been about Bitcoin for a long time. (image.ibb.co),[Chill out] That guy who doesn't understand bitcoin (v.redd.it),The adoption is increasing Day By Day! Bitcoin payments accepted in Russia (Fifa 2018) (cryptotrends.in),Me looking at my what is left in my portfolio today (v.redd.it),Very inspired when reading “The Internet of Money” by Andreas A. (self.Bitcoin),"What is MimbleWimble - Bitcoin's Privacy, Fungibility and Scalability Solution (tokenthusiast.com)",Electrum Personal Server beta release (self.Bitcoin),Scrolling Through my Blockfolio... (twitter.com),Russian Hotels to Surprise World Cup Fans with Bitcoin Payments (self.Bitcoin),Roger Ver Lies (2.0) (youtu.be),"MimbleWimble offers privacy by default, more fungibility and better scale-ability of #bitcoin. Since it doesn't support scripts, it would likely be implemented as a sidechain. It is also tied to Elliptic Curve Cryptography and is not well prepared for quantum computing ... yet. (twitter.com)","Daily Discussion, March 29, 2018 (self.Bitcoin)","This sockpuppet account is run by bitcoin.com ""journalist"" Jamie Redman. Paid for by Roger Ver. Time to shut down bitcoin.com for good? (twitter.com)",The Federal Reserve - silently robbing you of your purchasing power ever since 1913... (twitter.com),"After 255 straight days on track to the McAfee prediction, the price just dipped below the curve for the first time (fnordprefect.de)",I got a spot on local news to chat Bitcoin (calgary.ctvnews.ca),Ukraine Created it’s Own Cryptocurrency But Drowned in the Bureaucracy. Seems like our government cant do nothing PROPERLY. What a shame… (blockonomi.com),"Forbes - Looking Ahead To $20,000 Bitcoin (forbes.com)","Polls Indicate South Koreans in Twenties, Thirties, Heavily Invested in Crypto (bitcoinnews.com)","I just donated someone 6 cents and paid 0,00012 USD fee... with lightning! (self.Bitcoin)",Bitcoin's popularity in Africa continues to soar. This was the whole idea behind bitcoin and crypto - economic freedom. Not get rich quick scheme. (decentralpost.com),Bitcoin ATMs are now in the Toronto Subway System (localcoinatm.com),
2018-03-30,Bitcoin became 99% more interesting when I stopped comparing my holding to fiat and just concentrated on increasing my btc amount from trading. (self.Bitcoin),So heres the thing about a 7k bitcoin... (self.Bitcoin),"Don't let the negativity get you down. The future is bright, adoption will continue to grow, and Bitcoin is here to stay. (self.Bitcoin)",Japanese Luxury Car Dealer Accepts Bitcoin Payments Up to $1 Million (ccn.com),"Daily Discussion, March 31, 2018 (self.Bitcoin)",You’re all crazy (self.Bitcoin),FCC authorizes Elon Musk's SpaceX to provide broadband satellite services - (Global internet will be a major step for future bitcoin adoption and growth. This is a game changer) (cnbc.com),Anyone else oddly feeling alright during these times? (self.Bitcoin),Intel Files Patent For Energy-Efficient Bitcoin Mining Hardware (crn.com),Why PoS is still as inferior to PoW as it was in the very beginning by its design and essense. (self.Bitcoin),Dimitri understands it! You too? (v.redd.it),historically most of BTCs annual return was delivered over just 9 days (avg) out of the year. Hard to know which days will be drivers. A merit of HODLing. (twitter.com),"My friend invested 200K at 18500$ - take a chill pill, read my points and please contribute/upvote (self.Bitcoin)",This is probably the last dip we are looking at this year best time to invest market is at 266 billion right wont go any lower who else agrees to this (self.Bitcoin),Brothers and Sisters of bitcoin. Let’s make this the 🐣 of bitcoin. (self.Bitcoin),"Here is someone paying for lunch in Venezuela where $1 USD equals $107,000 Bolivar, thanks to the government and hyperinflation. This is why bitcoin and gold will win. (twitter.com)",The Bitcoin Miner - Behind the Scenes (i.redd.it),PSA: Bitmain is selling off our contact info to spammers (self.Bitcoin),Perfect time to be buy? (self.Bitcoin),Now pay for hotels in Russia during FIFA through bitcoins (blockmanity.com),Japanese Luxury Car Dealer Accept BTC As Payment ! (youtube.com),OKEX exchange to reverse bitcoin transactions yesterday (suspects market manipulation) (ccn.com),"Big banks continue to knowingly fund the black market and assist money laundering. While Bitcoin cannot be banned, these banks can and should be. (theage.com.au)","Your portfolio is like a bar of soap - the more you handle it, the smaller it gets. (self.Bitcoin)","Bitcoin transaction fees again reached low levels, and have hit 1 Satoshi per byte to get into the next block. (plus.google.com)","Bitcoin price trading in a range below $7,000: Tom Lee tells cryptocurrency investors to hold on, Bitcoin will hit $25,000 end of 2018 (fxstreet.com)",
2018-03-31,Just noticed Nord VPN accepts Bitcoin. (nordvpn.com),"Jack Dorsey, chief executive of Twitter - BTC Will Become Primary Global Currency (self.Bitcoin)","I wonder, how many people here have formal economics education? (self.Bitcoin)","It's official. I'm a ""Bitcoin Millionaire"" (self.Bitcoin)","Daily Discussion, March 31, 2018 (self.Bitcoin)",G Maxwell is the Only Reason Bitcoin has Survived to this Day (self.Bitcoin),Banks' Hypocrisy: Ban Bitcoin But Mafia Boss Is Ok To Work With (tokenthusiast.com),Newegg Expanding Bitcoin Payment Option to Customers in Canada (dcebrief.com),Bitcoin Adoption is Real... Bitcoin signs and vendors are now everywhere! (goldtelegraph.com),At Last: Halong Mining is NOT a Scam – nopara73 – Medium (medium.com),"I'm making a simple Windows application that can read trade histories from ""any"" exchange (self.Bitcoin)","Australia's Biggest Bank: No to Bitcoin, Yes to Mafia Money Laundering (bitcoinist.com)","My friend invested 200K at 18500$ - take a chill pill, read my points and please contribute/upvote (self.Bitcoin)",very strange trading at bitfinex (self.Bitcoin),In time. Bitcoins won't need to be changed into dollars any more than email needs to be printed. (self.Bitcoin),Why Every Bitcoin Fan Should be Excited About Schnorr Signatures (decentralpost.com),Bitcoin - You Are Here. Adoption of Technology in the US (i.redd.it),MRW I buy all the BTC dips and finally catch a bottom (i.redd.it),Millennial-owned investment firm becomes first EVER to purchase equity assets with Bitcoin (washingtonexaminer.com),Prepare to see a rising in Bitcoin price (self.Bitcoin),"Nvidia CEO Believes Cryptocurrency Will Be Core Business for Company, Hello miners :) (bitcoinist.com)",Japanese Luxury Car Dealer Accept BTC As Payment ! (youtube.com),Intel Pursues Patent for Bitcoin Mining Hardware Accelerator (bitcoinnews.com),Bitcoin price history by CZ CEO Binance (twitter.com),Bitcoins Future is Bright (twitter.com),Stop the GPU abuse! (youtu.be),
2018-04-01,Found this at my friend’s college dorm... (i.redd.it),You know you want it (i.redd.it),Found a great Spyware on Samouraï Wallet recovery tool (they removed it) (linkedin.com),Are we about to get Bart Simpson'ed again? (pbs.twimg.com),Listen to him! (i.redd.it),"Just a reminder. They control the media. They control the banks. Don't let the fear, uncertainty and doubt get into your mind. Stay strong. (twitter.com)","Burlington, Vt Police Now Accept Bitcoin as Payment (twitter.com)","Bitcoin Lightning Hits Record Node Count, Reaches $70k Capacity (bitcoinist.com)","Cryptocurrency investment linked to 3-fold increase in stress levels, alcohol abuse and premature death. (ncbi.nlm.nih.gov)",London Black Cab accepts payment via bitcoin 💪🏽💪🏽💪🏽💪🏽 (i.redd.it),Sad (i.redd.it),In the heart of Silicon Valley (i.redd.it),When your amazing idea to show how much more efficient Bcash is goes wrong... (v.redd.it),"On today's date 1st April 2012, P2SH (pay-to-script-hash) was added to bitcoin via a soft fork (github.com)","Daily Discussion, April 01, 2018 (self.Bitcoin)",MRW I buy all the BTC dips and finally catch a bottom (i.redd.it),"Bitrefill refocuses on shitcoins, rebrands to Shitrefill (medium.com)","Ignored By Big Telecom, Detroit's Marginalized Communities Are Building Their Own Internet (motherboard.vice.com)",Spotted in the Montreal wilderness (imgur.com),The Future Of Currency (facebook.com),"Satoshi Nakamoto was an easyDNS customer, and we know who it is… (easydns.com)",Lambos are so 2017. Get a TREZOR Scooter instead! (blog.trezor.io),Just bought the dip and will put one BTC on look down for my 4 year old daughter and give it to her on her 18th birthday. (self.Bitcoin),r/Bitcoin recap - March 2018 (self.Bitcoin),April fools! The dip was just one big joke. The whales got us good. (self.Bitcoin),Come on sweet baby Easter bitcoin. (i.redd.it),Status in Lightning Network Land: Steady Growth in Channel and Node Numbers. Capacity more than 10 BTC - still small but growing (decentralpost.com)
2018-04-02,You know you want it (i.redd.it),Listen to him! (i.redd.it),London Black Cab accepts payment via bitcoin 💪🏽💪🏽💪🏽💪🏽 (i.redd.it),"Daily Discussion, April 02, 2018 (self.Bitcoin)","Found a bitcoin ""vending machine"" (i.redd.it)",Why Bitcoin is Different (medium.com),Went away for a week. Now I'm the proud owner of 1 bitcoin. (self.Bitcoin),Facebook wall screenshot of 5 years ago (i.redd.it),This April Fools’ Day joke has hidden some good reasons to invest in Bitcoin (i.redd.it),Could someone tell the guys at Marvel that there will only be 21 million Bitcoin? (i.redd.it),Created BIP39 wordlist on ONE sheet of paper. Have fun with it. (u.cubeupload.com),Google Trends on Bitcoin - Newcomers don't care anymore. I find it funny that people will start care again only in case of new ATH. (i.redd.it),Why are so many people so bitter about Bitcoin? (self.Bitcoin),Saxo Bank: Bitcoin will cost $100 000 in 2018 (coinstaker.com),Despite Bitcoin's 'Sell-Off' The Cryptocurrency Space Continues To Attract Investors (forbes.com),Hodl (i.redd.it),Spotted in Groningen (NL) (i.redd.it),The elephant in the room (self.Bitcoin),Spotted in the Montreal wilderness (imgur.com),Russian State-Owned Bank To Trial Crypto Transactions (bitcoinnews.com),"When Lightning is fully implemented by Bitcoin, how will a typical transaction from a wallet look like? (self.Bitcoin)","Despite Price Slump, Bitcoin Adoption is Strong in Japan and South Korea, With Largest E-Commerce, Retailers, Airlines, and Hotels Accepting Bitcoin (newsbtc.com)","Satoshi Nakamoto was an easyDNS customer, and we know who it is… (easydns.com)",Hey guys I found the baloney that's pushing the price down (i.redd.it),Just bought the dip and will put one BTC on look down for my 4 year old daughter and give it to her on her 18th birthday. (self.Bitcoin),r/Bitcoin recap - March 2018 (self.Bitcoin),Come on sweet baby Easter bitcoin. (i.redd.it)
2018-04-03,"Coinance for Android Has Launched & v1.2 Update for iOS: Add Coins Manually, Check Your Portfolio Development And Much More! (medium.com)",/r/allInvesting Tips from a Pro (i.redd.it),Spotted this in my home town in Michigan (i.imgur.com),"Don’t worry reddit, the $6500 dip was only an April Fools joke. (i.redd.it)",LND 4.1 released (twitter.com),Bitcoin is Now Listed as the Norm in the Business Section (i.redd.it),"I'm an idiot, don't be like me. (self.Bitcoin)",Please Clap. (i.redd.it),"Found a bitcoin ""vending machine"" (i.redd.it)",Cartoon Network made a reference to bitcoin in their new show.. (i.redd.it),It Lives!!!! Bitcoin at 7400 (self.Bitcoin),"Bitcoin Price Watch BTC/USD Edges Slightly Higher, Looking To Break $7,500 (frontlatest.com)","Vitalik kicking ass at Deconomy, calls out fake, fraud satoshi (twitter.com)",3 years ago today - remindme (self.Bitcoin),Just founded a LN channel in 2 blocks with $0.01 fee. (self.Bitcoin),New AML/CTF Rules for Australia’s Bitcoin Exchanges Become Effective Today (coinjournal.net),JPMorgan failed 175 times trying to patent their own version of blockchain tech (twitter.com),"Fake Satoshi double owned: ""I wrote the lightning network paper and I didn't understand a word of your presentation"" (youtube.com)",This is what happens when you block Canadians from buying bitcoin with their Credit/Debit card. (coin.dance),My Local Newspaper Has Bitcoin in the Cover Page. (i.redd.it),Sounds like Rogers speech at Deconomy went over well (twitter.com),"Daily Discussion, April 03, 2018 (self.Bitcoin)",Pure comedy on Twitter with @CobraBitcoin feat. Satoshi himself (imgur.com),Vitalik Buterin calls out Craig Wright for what he is (twitter.com),Bitcoin in 2018 (i.imgur.com),Bitcoins killer use case (self.Bitcoin),r/Bitcoin recap - March 2018 (self.Bitcoin)
