,1,2,3,4,5,6,7,8,9,10,11,12,13,14,15,16,17,18,19,20,21,22,23,24,25,26,27
2018-02-13,"BLOOMBERG: ""South Korea’s government gave the strongest signal yet that it will allow cryptocurrency exchanges to keep operating in the country, a welcome development for traders who had feared an outright ban in one of the world’s biggest markets for digital assets"". (bloomberg.com)",MICROSOFT AGREES!: On-Chain Scaling Is NOT Possible/Less And Less Decentralized (bitcoinist.com),The Story of Andreas Antonopolous: The Bitcoin Messiah! (unblock.net),Bitcoin's greatest achievement- It made us reassess fiat money. (self.Bitcoin),bitcoin is at 9600! (self.Bitcoin),Pineapple Fund drops $1M [in bitcoin] on the Sustainable Ocean Alliance and its new accelerator (techcrunch.com),Great tweet from Charlie Lee ! B 💵 (i.redd.it),"Guys, bitcoin is $9k+!!! (self.Bitcoin)",Pay Income Tax With Bitcoin: Arizona Bill Passes in Senate (blog.coinninja.com),"Up, down, up, down, left, right, left, right, B, A, LB, RT🎮 (i.redd.it)",CFTC Votes To Create Virtual Currency Subcommittee (cryptocurrencyfreak.com),"Bitcoin ""experts"" suggest you stay away, so they can accumulate more for themselves. (finance.yahoo.com)","@nodefather on twitter: On Friday Feb 9, I was arrested in my home by Department Of Homeland Security over a #Bitcoin transaction from nov 2016 and am released under a personal recognizance bond. I am being charged with: 18 USC 1956 - Money Laundering Instrument (twitter.com)",Advances in Block Propagation - Greg Maxwell (youtube.com),"The largest exchange in South Africa, Luno, now has full SegWit integration! (luno.com)","Lightning Network has grown tremendously on mainnet, so have we learned anything? (self.Bitcoin)","Dips are red, Coinbase is blue. Shitcoins aren’t sweet, Bitcoin is true. (self.Bitcoin)",Idiots Making Cryptocurrency Vids - ITS TIME TO STOP (youtu.be),"Bitcoin succeeds in part because it has no leader, no ""Jesus"", no ""messiah"". Bitcoin succeeds largely because it's face is... us. Please don't give anyone such a status. It's Paramount to Bitcoin's success. (self.Bitcoin)","IT'S OVER 9000!! (Especially loved the ending on this one, got me pumped @ 1:05) (youtube.com)","Daily Discussion, February 14, 2018 (self.Bitcoin)",Roger Ver's lighting bitcoin node... (i.redd.it),"/r/allI've spent the last 4 months jobless building a Desktop Cryptocurrency Tracker: Moonitor. I'm not 16, my dog mentors me (true story) and no human touched/committed my code. Can I get some downloads/feedback please? (moonitor.io)",A perspective on the recent crash (self.Bitcoin),"""There is one lightning node no one wants to connect with. Zooming in reveals why. 😂"" (twitter.com)",I am so unbelievably excited to share with you all that my art company's website now proudly accepts BTC (lynxartcollection.com),Today I sold my house for 35 Bitcoin! Going to travel the world for 2 years and the hopefully buying a house double the size for less btc (self.Bitcoin)
2018-02-14,"BLOOMBERG: ""South Korea’s government gave the strongest signal yet that it will allow cryptocurrency exchanges to keep operating in the country, a welcome development for traders who had feared an outright ban in one of the world’s biggest markets for digital assets"". (bloomberg.com)",MICROSOFT AGREES!: On-Chain Scaling Is NOT Possible/Less And Less Decentralized (bitcoinist.com),The Story of Andreas Antonopolous: The Bitcoin Messiah! (unblock.net),Bitcoin's greatest achievement- It made us reassess fiat money. (self.Bitcoin),bitcoin is at 9600! (self.Bitcoin),Pineapple Fund drops $1M [in bitcoin] on the Sustainable Ocean Alliance and its new accelerator (techcrunch.com),Great tweet from Charlie Lee ! B 💵 (i.redd.it),"Guys, bitcoin is $9k+!!! (self.Bitcoin)",Pay Income Tax With Bitcoin: Arizona Bill Passes in Senate (blog.coinninja.com),"Up, down, up, down, left, right, left, right, B, A, LB, RT🎮 (i.redd.it)",CFTC Votes To Create Virtual Currency Subcommittee (cryptocurrencyfreak.com),"Bitcoin ""experts"" suggest you stay away, so they can accumulate more for themselves. (finance.yahoo.com)","@nodefather on twitter: On Friday Feb 9, I was arrested in my home by Department Of Homeland Security over a #Bitcoin transaction from nov 2016 and am released under a personal recognizance bond. I am being charged with: 18 USC 1956 - Money Laundering Instrument (twitter.com)",Advances in Block Propagation - Greg Maxwell (youtube.com),"The largest exchange in South Africa, Luno, now has full SegWit integration! (luno.com)","Lightning Network has grown tremendously on mainnet, so have we learned anything? (self.Bitcoin)","Dips are red, Coinbase is blue. Shitcoins aren’t sweet, Bitcoin is true. (self.Bitcoin)",Idiots Making Cryptocurrency Vids - ITS TIME TO STOP (youtu.be),"Bitcoin succeeds in part because it has no leader, no ""Jesus"", no ""messiah"". Bitcoin succeeds largely because it's face is... us. Please don't give anyone such a status. It's Paramount to Bitcoin's success. (self.Bitcoin)","IT'S OVER 9000!! (Especially loved the ending on this one, got me pumped @ 1:05) (youtube.com)","Daily Discussion, February 14, 2018 (self.Bitcoin)",Roger Ver's lighting bitcoin node... (i.redd.it),"/r/allI've spent the last 4 months jobless building a Desktop Cryptocurrency Tracker: Moonitor. I'm not 16, my dog mentors me (true story) and no human touched/committed my code. Can I get some downloads/feedback please? (moonitor.io)",A perspective on the recent crash (self.Bitcoin),"""There is one lightning node no one wants to connect with. Zooming in reveals why. 😂"" (twitter.com)",I am so unbelievably excited to share with you all that my art company's website now proudly accepts BTC (lynxartcollection.com),Today I sold my house for 35 Bitcoin! Going to travel the world for 2 years and the hopefully buying a house double the size for less btc (self.Bitcoin)
2018-02-15,/r/allCan you feel the Pumpening? (v.redd.it),The Crash of 2018 - a historical reenactment of what happened in the last month (youtube.com),Joe Rogan talks bitcoin/crypto.. yet again (youtu.be),"Instead of Selling Natural Gas, This Canadian Company will Mine Bitcoin (btcmanager.com)","It's Confirmed, South Korea Won't Ban Trading of Cryptocurrencies like Bitcoin (kryptomoney.com)",Coinbase Admits It Accidentally Overcharged Buyers (thenextweb.com),Bank of America Has Filed More Cryptocurrency Patents Than Any Other Company (monetse.com),"It's official! 1 Bitcoin = $10,000 USD (again) (v.redd.it)","Bitcoin Adoption and User Growth Estimation | One Coin Can Reach $1,200,000 (youtube.com)",Advances in Block Propagation - Greg Maxwell (youtube.com),Can't touch this! (v.redd.it),Ellen DeGeneres explains what bitcoin on her show. (twitter.com),"🔑Supporting Let's Encrypt, 🐶pet rescue, 🏞river protection. And how we hilariously thwarted a scammer. 😄 (self.Bitcoin)","All 50 apartments listed in Bitcoin, sold out in Dubai (cryptocoin123.com)",Andreas Antonopoulos: Misconceptions about Lightning Network (youtube.com),Africa's first bitcoin exchange sets goal of 1 billion customers by 2025 (money.cnn.com),Question : Is there an app to show the btc price in the top corner of the phone like the battery level ? (self.Bitcoin),Olympics 2018: U.S. Luge Team Seeks Bitcoin Donations (fortune.com),JP Morgan openly praises Bitcoin (cryptodaily.co.uk),"Tim Draper: Why Would I Sell Bitcoin, The Future of Currency? (bitcoinist.com)","Bitcoin is back. A middle finger to Nouriel Roubini, Krugman and every crap economical ""expert"" of this world (i.redd.it)","Daily Discussion, February 16, 2018 (self.Bitcoin)",TOM LEE: Bitcoin will surge to new record highs by July (bitcoinnews.infos.st),"Bitcoin soars above $10,000 on Coinbase as cryptocurrencies extend rally (cnbc.com)",What I love most about bitcoin is how the bad guys just can't take it over. (self.Bitcoin),Paybear Announcement: We just launched a fully functional payment gateway that supports Bitcoin. What does /r/Bitcoin think? (paybear.io),US Bank Pays $613 Million for Money Laundering (as Financial ‘Experts’ Warn Us about Bitcoin?) (washingtonpost.com)
2018-02-16,Joe Rogan talks bitcoin/crypto.. yet again (youtu.be),/r/allCan you feel the Pumpening? (v.redd.it),The Crash of 2018 - a historical reenactment of what happened in the last month (youtube.com),"Instead of Selling Natural Gas, This Canadian Company will Mine Bitcoin (btcmanager.com)",Coinbase Admits It Accidentally Overcharged Buyers (thenextweb.com),Bank of America Has Filed More Cryptocurrency Patents Than Any Other Company (monetse.com),Spanish Government Eyes Tax Benefits for Crypto Companies - CoinDesk (coindesk.com),"It's official! 1 Bitcoin = $10,000 USD (again) (v.redd.it)","Bitcoin Adoption and User Growth Estimation | One Coin Can Reach $1,200,000 (youtube.com)",Advances in Block Propagation - Greg Maxwell (youtube.com),Bitcoin Core 0.16 RC4 tagged - Hopefully the final one before release (github.com),Ellen DeGeneres explains what bitcoin on her show. (twitter.com),Awesome Crypto talk with Winklevoss Twins and Mike Novogratz +! Thanks MilkenInstitute! (youtu.be),"All 50 apartments listed in Bitcoin, sold out in Dubai (cryptocoin123.com)",Andreas Antonopoulos: Misconceptions about Lightning Network (youtube.com),When comparing cryptocurrency prices on graphs they all seemed to mirror each other until very recently. What has changed in the market to allow each coin to take their own path? (self.Bitcoin),Ellen DeGeneres Just Introduced Bitcoin to Her 3 Million US Viewers (bitcoinist.com),What do you call it when two transgender midgets have sex? (self.Bitcoin),Olympics 2018: U.S. Luge Team Seeks Bitcoin Donations (fortune.com),"Tim Draper: Why Would I Sell Bitcoin, The Future of Currency? (bitcoinist.com)","Bitcoin is back. A middle finger to Nouriel Roubini, Krugman and every crap economical ""expert"" of this world (i.redd.it)","Daily Discussion, February 16, 2018 (self.Bitcoin)",TOM LEE: Bitcoin will surge to new record highs by July (bitcoinnews.infos.st),Reducing the risk profile of custody with custody channels (self.Bitcoin),"Bitcoin soars above $10,000 on Coinbase as cryptocurrencies extend rally (cnbc.com)",What I love most about bitcoin is how the bad guys just can't take it over. (self.Bitcoin),Dutch TV Presentator Shilling BTC Live on Television (twice in one hour) (v.redd.it)
2018-02-17,"Striking similarity between Ellen DeGeneres' 2018 ""Bitcoin Explanation"" and 1994 Today's Show ""What is the Internet, Anyway?"" (self.Bitcoin)",McAfee discovers new malware from the Lazarus Group for the theft of Bitcoins (studiobitcoin.com),US Government Not Passing Bitcoin Regulations Anytime Soon According To White House Official (ccn.com),Getting kids into crypto. (self.Bitcoin),/r/allEllen DeGeneres Just Introduced Bitcoin to Her 3 Million US Viewers (bitcoinist.com),"Remember when Bitcoin died, again? A moment of silence for those who do the exact opposite of hodl. (twitter.com)",Bank of America Has Filed More Cryptocurrency Patents Than Any Other Company (monetse.com),US Government will not Pass Bitcoin Regulations Soon (medium.com),Visa confirms Coinbase wasn’t at fault for overcharging users (techcrunch.com),Advances in Block Propagation - Greg Maxwell (youtube.com),Once all of the coins are mined who will take care of the blockchain? (self.Bitcoin),The Great Bitcoin Crash of 2018. (youtu.be),CSE announces plans for blockchain trading platform (monetse.com),A restaurant near me is accepting bitcoin! (i.redd.it),Bitcoin referenced in new American Dad episode (self.Bitcoin),Financial Regulators Are Unable to Control the Crypto Market (bitcoinist.com),Strange request from Circle (self.Bitcoin),Joe Rogan talks about Bitcoin and other Cryptocurrencies [Episode #1079] (youtube.com),Conference in Switzerland . 21 Feb 2018 (coinpriceprediction.com),Where are all the news stories about BTC futures traders and their short positions getting liquidated? (self.Bitcoin),2 mansions in San Diego for sale for Bitcoin (bitcoinist.com),Banksy Bitcoin graffiti spotted in Paris: R.I.P. Fiat. (i.redd.it),"Daily Discussion, February 17, 2018 (self.Bitcoin)",Bitcoin capital of the world revealed as Japan’s government doubles down on multi-billion pound plot to boost its economy. (self.Bitcoin),"Joint Statement from Visa and Worldpay for Coinbase customers - Regarding duplicate transactions: ""This issue was not caused by Coinbase."" (blog.coinbase.com)","""Shark Tank"" Host Robert Herjavec Says Bitcoin Price Will Skyrocket! (youtu.be)","How to host Bitcoin Core, LightningD and Lightning Charge in one click (youtu.be)"
2018-02-18,Just a not sober post (self.Bitcoin),Bitcoin Scaling (Andreas Antonopoulos) (youtube.com),"Andreas Antonopolis ""Bitcoin's Killer apps"" (youtube.com)","Samsung Is Now Building Bitcoin Mining Chips, News Outlet (cryptocurrencyweb.online)",/r/allBitcoin Doesn't Give a Fuck. (v.redd.it),I just bought my first ever BTC (self.Bitcoin),Lightning Network and Discreet Log Contracts - Thaddeus Dryja (youtube.com),"64% of Germans are aware of Bitcoin, says IT Bitkom (robosem.net)",Switzerland's financial regulator just issued landmark guidance on ICOs. Here's brief tweet tempest breaking down the high points and how it fits into the big picture. (twitter.com),"Enjoy the current Bitcoin market conditions and the journey ahead. One day, when BTC is sitting at a $5 trillion market cap, we'll look back at how exciting and volatile it used to be. Because at $5 trillion, it'll be stable (and boring!) like gold is today. We'll wish back the volatility. (self.Bitcoin)",Visa confirms Coinbase wasn’t at fault for overcharging users (techcrunch.com),A New York University student paid his four-year tuition with bitcoin profits (cryptoren.com),These guys are using Bitcoin to reward the crowd for recommending professionals for jobs and gigs (coinvet.com),The Great Bitcoin Crash of 2018. (youtu.be),"Daily Discussion, February 18, 2018 (self.Bitcoin)","shitpostHODLERS, prepare for Glory (self.Bitcoin)",Why is no one talking about the whale that recently purchased approx. 400 million in BTC? (self.Bitcoin),Gold is the money of kings; silver is the money of gentlemen; barter is the money of peasants; but debt is the money of slaves. – Norm Franz <-- Bitcoin is the money of the people! (twitter.com),"Bitcoin could bounce back big time in 2018: analyst, NY Times (nypost.com)",Most of the reports from congressional hearing are there was a lot of discussion about complete handsoff approach like the internet had for 20 years. That and prior anger from congress about the IRS overeach with Coinbase are just incredibly good and important news. (self.Bitcoin),“Montecrypto: The Bitcoin Enigma” Video Game Offers A Bitcoin To First Player Who Solves All 24 Enigmas (btcnn.com),PSA: It's easier to HODL if you move your coins off an exchange - You won't be able to insta-sell in panic. (self.Bitcoin),Poland's Central Bank Secretly Paid Youtubers to Slander Cryptos (trustnodes.com),looks like it might be a worthy time to share this again (i.redd.it),History of Bitcoin 2009-2018 (Git Visualization) (youtube.com),"Yacht company says they'll take bitcoin, other cryptocurrencies for payment (cnbc.com)",Lightning powered vending machine! Buy Beans for Bits - https://beans4bits.com/ (twitter.com)
2018-02-19,Bitcoin broke through 11k for the first time since January (cnbc.com),Spotted this dude cheering at the Olympics! (i.redd.it),"Rejoice, for the day foretold in prophesy has arrived... (redd.it)",Successful people discussing the benefits of bitcoin and other cryptocurrencies... Quite reassuring to see some of the smartest people speak so positively about crypto (bitguru.co.uk),Lightning Network and Discreet Log Contracts - Thaddeus Dryja (youtube.com),The number of Cryptocurrency Hedge Funds doubled in the last 4 months (coinsocial.io),"Australian juice company Boost is giving away four bitcoins -- one a week, for four weeks -- to those that buy some juice and enter a code in the Boost app. (cnet.com)",Headphones.com is accepting Bitcoin! (self.Bitcoin),"CFTC offers $100,000 for pump and dump whistle blowers (monetse.com)",Do not buy bitcoin at bitnovo.com (cheating site) (self.Bitcoin),"While many European countries are looking for stricter rules on cryptocurrencies, Spain wants to follow Switzerland, proposing a friendly legacy for the cryptocurrency market. The People's Party of Spanish Prime Minister Mariano Rajoy is ready to take full advantage of Blockchain technology. (forexcentral.info)",Africa May Be One Of The Biggest Markets For Bitcoins and Cryptocurrencies (kryptomoney.com),$2.1M minimum net worth to use their services. Interesting ad in a local print publication... it’s spreading. (i.redd.it),"We suspected this already due to prior node count cliffs, but evidence continues to mount that 80% of Bitcoin Unlimited nodes were owned by a single entity. Now there are fewer than 100 in operation. (twitter.com)","""Bitcoin is a tool for freeing humanity from oligarchs and tyrants, dressed up as a get-rich-quick scheme."" - CEO of Angel List (self.Bitcoin)",White House Official: Bitcoin Regulation Won’t Happen Anytime Soon (logicalworld.net),How fast is the lightning network? Too fast. (vimeo.com),"Daily Discussion, February 19, 2018 (self.Bitcoin)",Paper wallets warning - they are not as safe as you might think! (self.Bitcoin),Indian Prime Minister Office tweets about embracing Blockchain (twitter.com),"KDE received $200,000 from the Pineapple Fund? (twitter.com)",Korea back in business after Lunar new year (verifiedtopics.com),"So, I sold some of my bitcoins and bought an old BANK. Ironic enough? (i.redd.it)",Does the fact that the 100 richest bitcoin addresse adding/not selling off prove promising for Bitcoin? (self.Bitcoin),"23% Of Organizations Globally Affected By Crypto-Mining Malware Coinhive, Says Cybersecurity Firm (coinjournal.net)","""Here's why you can't really have blockchain without bitcoin"" -- finally, a news anchor who doesn't seem to be clueless ... (twitter.com)",Polish Youtuber was paid ~30 000$ By Polish Bank to create FUD video about cryptocurrencies for his viewers (cryptovibes.com)
2018-02-20,Kraken enables advanced orders and adds 10 currency pairs (blog.kraken.com),Bitcoin broke through 11k for the first time since January (cnbc.com),South Korean Cryptocurrency Regulator Found Dead at Home (wsj.com),"South Korea's Financial Regulator Greenlights Cryptocurrencies: Mr. Choe said the government will ""encourage"" banks to make transactions with cryptocurrency exchanges. (english.yonhapnews.co.kr)",Bitcoin 0.16.0 Update Introduces SegWit Wallet Support (coindaily.co),Elon Musk's reaction to the Bitcoin bull run🚀 (v.redd.it),California Bill would Legally Recognize Blockchain Data (coindesk.com),I asked my boss to pay me in BTC. I will now get my salary bi-weekly in bitcoin equivalent (self.Bitcoin),Lightning Network and Discreet Log Contracts - Thaddeus Dryja (youtube.com),"Daily Discussion, February 20, 2018 (self.Bitcoin)","Free engagement ring, thanks bitcoin! (self.Bitcoin)",Bitcoin is finally set to do it's job. CHANGING THE WORLD. (self.Bitcoin),Hodlers win every time (self.Bitcoin),Polish Youtuber was paid ~30 000$ By Polish Bank to create FUD video about cryptocurrencies for his viewers (cryptovibes.com),Here's a little something from 2013 you can show your friends/family when they start talking about bitcoin being a bubble. (i.redd.it),White House Official: Bitcoin Regulation Won’t Happen Anytime Soon (logicalworld.net),Mempool has now been empty for three consecutive weeks. 1 sat / byte txs are being cleared on the next block. Sending bitcoin still costs a fraction of a cent. Scaling debates are now a thing of the past. (twitter.com),"Max continues his interview with investment manager, Mark Yusko, about cryptocurrency and big picture investment themes for 2028. (youtu.be)",Which are your favorite sites for comparing bitcoin's position & statistics relative to other crypto coins? (self.Bitcoin),"JPMorgan Flip-Flops, Even Encouraging Clients To Invest in Bitcoin! (stopthefud.wordpress.com)","So, I sold some of my bitcoins and bought an old BANK. Ironic enough? (i.redd.it)",South Korera Greenlights Cryptocurrencies (verifiedtopics.com),"Bitcoin Exchange's bank, ING Bank may be under investigation by Dutch government for ties to Tether. (twitter.com)",Seen in Miami Boat Show (i.redd.it),"""Here's why you can't really have blockchain without bitcoin"" -- finally, a news anchor who doesn't seem to be clueless ... (twitter.com)",New Bitcoin Code Will Finally Boast Full SegWit Support (coindesk.com),"Remember, when you deposit 'money' in a bank. You don’t actually own anything in a bank —your assets are the unsecured liability of an institution that could very well go bankrupt. (twitter.com)"
2018-02-21,Coinbase targeting Segwit support by next week (twitter.com),"Finally! Coinbase: ""Our engineering team has finished testing of SegWit for Bitcoin on Coinbase. We will be starting a phased launch to customers over the next few days and are targeting a 100% launch to all customers by mid next week"". (twitter.com)",Bitfinex Adopts SegWit (medium.com),Stripe gave up on us? Stripe's loss ¯\_(ツ)_/¯ Here are five other payment alternatives which are carrying the Bitcoin torch forward. (blog.blockonomics.co),Tesla Hit by Hackers Who Used its Systems to Mine Cryptocurrency (monetse.com),California Could Soon Recognise Blockchain Data As Legally Binding (verifiedtopics.com),PayPal Exec Says ‘Very High Likelihood’ Bitcoin Will Become Popular Payment Method (cointelegraph.com),Study: SMEs Believe Cryptocurrency Payments Will Hit the High Street in Two Years (coinjournal.net),Lightning Network and Discreet Log Contracts - Thaddeus Dryja (youtube.com),First Plastic Surgery Clinic in Texas to Accept Cryptocurrency (americanhealthandbeauty.com),Bitcoin bears (imgur.com),"Goodbye HODLing, Hello ‘Spend and Replace’ (self.Bitcoin)",Hype Bitcoin...Segwit works!!!! (self.Bitcoin),"Someone donated 1 BTC for Samourai wallet, a free wallet for everyone (twitter.com)",SegWit is Coming to Coinbase and Bitfinex’s Bitcoin Exchanges (bitcoinmagazine.com),Wyoming House Unanimously Approves Two Pro-Blockchain Bills (bitcoinmagazine.com),Very accurate representation of how my portfolio is doing (v.redd.it),Sweden Worried It’s Gone Too Far & Why Bitcoin Will Be the Real Winner in the War on Cash (bitcoinist.com),Always Remember that UASF brought us SegWit (twitter.com),A Perfect Crypto-storm is Brewing in the Philippines. Really Exciting Stuff! (medium.com),Bitcoin Regret Club (bitcoinregret.club),PayPal CFO Sees Positive Future For Bitcoin (pymnts.com),"My girlfriend and I spent the last 3 months creating a unique crypto portfolio app - one tap trade imports, historical tracking, event triggers, etc. Can we have some feedback? (self.Bitcoin)","""It Is Very Hard To Regulate Bitcoin"" - Rep. Schweikert (youtube.com)","Daily Discussion, February 21, 2018 (self.Bitcoin)",When is the best time to speak about bitcoin to the people you know? (self.Bitcoin),I won this poster a few weeks back. I guess now is the time to post this! (i.redd.it)
2018-02-22,Bitcoin Fees Plummet to Six Month Low as SegWit Soars (cryptocomes.com),You guys ever play that game “see how long I can go without checking the price” (self.Bitcoin),Thomas Lee Presents The Economics of Cryptocurrencies (youtu.be),Bulletproofs: Faster Rangeproofs and Much More (blockstream.com),"Daily Discussion, February 22, 2018 (self.Bitcoin)",Bloomberg reports that Bitcoin's 5-day 'winning streak' has been snapped. Excuse me? Bitcoin is on a 9-YEAR winning streak with 99.99% uptime. (twitter.com),Lightning Network and Discreet Log Contracts - Thaddeus Dryja (youtube.com),We are having a rally before a press conference at New York City Hall. Please join me (Abolish The Bitlicense) and Llew Cleensen (Bitcoin Foundation) answer press questions. (meetup.com),Iran Already Developing Its Own Cryptocurrency (btcnn.com),"ETF Industry Veteran Says Cryptocurrency ""Has The Power To Transform Financial Markets"" (zerohedge.com)","Someone donated 1 BTC for Samourai wallet, a free wallet for everyone (twitter.com)",Good news for Bitcoin! (cnbc.com),Transaction fees at $0.12 and Binance & Coinbase support for SegWit will bring this down even further (coinspecto.com),A reminder why you are here :) (youtube.com),Mempool just completely emptied. Now is the time to consolidate into a Segwit address at 1sat/byte. (jochen-hoenicke.de),Currently short positions are at an all time high since the correction with more than 20K ... expect a short squeeze soon (tradingview.com),Several Factors Are Driving Renewed Bullish Sentiment for Bitcoin (bitcoinist.com),"Polish central bank paid $26,764 for campaign agains crypto (cnbc.com)","American consumers are facing outstanding household debts of $12.73 trillion, with $1 trillion in credit card debt alone. <- Bullish for bitcoin. #Fiatbubble (goldtelegraph.com)",How to use Segwit with Electrum and Trezor - Step by Step Guide (blog.trezor.io),"I'm a 45 year old with arthritis and I built an anonymous futures exchange (Gold, Crude Oil, Sports, etc.) in C#; All trades settle in Bitcoin; Site is very rough, needs some QA / testing (self.Bitcoin)","My girlfriend and I spent the last 3 months creating a unique crypto portfolio app - one tap trade imports, historical tracking, event triggers, etc. Can we have some feedback? (self.Bitcoin)",Bitwise's Hougan Calls Bitcoin Multitrillion Dollar Opportunity (bloomberg.com),/r/allVery accurate representation of how my portfolio is doing (v.redd.it),PayPal CFO: Bitcoin's Success as a Currency is Very Likely (bitcoinist.com),Banks vs Bitcoin (i.redd.it),Venezuela 'Raises $735 million in ONE DAY' from sales of New Oil-Backed Petro Cryptocurrency (telesurtv.net)
