2018-03-15,"The U.S. House of Representatives Capital Markets, Securities, and Investments Subcommittee Holds First Cryptocurrency Hearing (coinjournal.net)",Mainnet Lightning payments available now on Bitrefill (blog.bitrefill.com),Bitcoin latest: Europe's richest royal family is 'open' to cryptocurrency investments (independent.co.uk),California Rep. Sherman badmouthing Cryptocurrencies is funded by a payment processor whose business is at risk. Not to mention the company was busted for money laundering. (opensecrets.org),An altcoin group keeps telling people that the Lightning Network doesn't scale because Mesh routing with adresses in the Network is an unsolved problem. Here is a paper with a solution. (self.Bitcoin),⚡️Announcing LND 0.4-beta ⚡️ (blog.lightning.engineering),"We are not the ""blockchain"" space: we are the ""cryptocurrency"" space (self.Bitcoin)",Bitcoin Art (i.redd.it),Billionaire Co-Founder of Brevan Howard Is Bullish On Bitcoin/Crypto (youtu.be),Ron Paul discussing bitcoin with Nassim Taleb (youtu.be),"Daily Discussion, March 15, 2018 (self.Bitcoin)","Bitcoin is a global network - if it was represented by physical land area, owning one bitcoin would be equivalent to owning 7 square miles of land (self.Bitcoin)",Google takes your privacy. Governments take your rights. Banks take your money. Corporations take your jobs. ... Bitcoin gives it all back. (twitter.com),Bitcoin Lightning Startup Goes Beta With Twitter CEO Backing (coindesk.com),Slovenia inaugurates world's first bitcoin monument (phys.org),Peter Thiel talks about HODL'ing to the New York Economy Club (youtu.be),"misleadingRemember: NOBODY went to jail for '08, and now US Senate moves forward with bill, easing regulations on banks (cnn.com)",Abra is the next coinbase ! (self.Bitcoin),"Dear @bitpay. This week I started setting up my own @BtcpayServer. When I discovered how easy it is, I contacted five vendors and clients I know who currently use your services. They're going to pay me to help them leave you. I'm sure my story isn't unique. You are ending now. (twitter.com)",India's biggest exchange migrating to Segwit (koinex.in),Technology Meant to Make Bitcoin Money Again Is Now Live (Bloomberg article) (bloomberg.com),"Bitcoin Hurts Govt 'Control' Of Dollar, Senator Lets Freudian Slip in Speech (bitcoinist.com)",India's biggest exchange migrating to Segwit (twitter.com),Peter Thiel is betting on Bitcoin because one cryptocurrency will become the 'online equivalent to gold' (cnbc.com),Schadenfreude of No-Coiners is palpable (self.Bitcoin),"In case you ever use Massdrop, vote on this link for them to accept Bitcoin as payment. #BitcoinAdoption2018 (massdrop.com)",
2018-03-16,Meet the Man Who Advocates Bitcoin for African Economies (btcmanager.com),New Survey Shows More than 60% Would Accept BTC in Lieu of USD. (bitcoinist.com),"Finally, the visa CEO launches vicious comments to Bitcoin. Now we know we're a competitor. (cnbc.com)",Peter Thiel is ‘Long Bitcoin’ and ‘Neutral to Skeptical’ of Everything Else (bitcoinist.com),Paypal co-founder Peter Thiel calls Bitcoin digital gold (blockmanity.com),"New webshop accepting Bitcoin, best cheese from Spain! (self.Bitcoin)","Trade, but don’t panic, and don’t panic trade. (self.Bitcoin)","Bitmain blocked @fluffypony due to Moner0 PoW changes, but haven’t blocked @CobraBitcoin for proposing the same for #Bitcoin. 🤔 (twitter.com)",It's happening boys !!! (ccn.com),California Rep. Sherman badmouthing Cryptocurrencies is funded by a payment processor whose business is at risk. Not to mention the company was busted for money laundering. (opensecrets.org),⚡️Announcing LND 0.4-beta ⚡️ (blog.lightning.engineering),Lightning Network Mainnet Release is Announced! (youtube.com),"The Government Seized Nearly Everything I Owned Despite Never Being Charged With a Crime, But They Couldn't Touch My Bitcoin (ir.net)","Peter Thiel: ""Bitcoin is like a hedge of sorts against the whole world falling apart"" (twitter.com)","Daily Discussion, March 16, 2018 (self.Bitcoin)",PSA: Xapo will freeze your bitcoin and demand documents AFTER you have deposited (self.Bitcoin) (self.Bitcoin),Indian exchange Zebpay with more than 3 million users explain how they reduced fees using Segwit and Batching (blog.zebpay.com),"During past bubbles, when institutional money starts to come in is when you really see the market take off. I say we are looking at 3-5 trillion market cap in the next 1-2 years. (reuters.com)","Binance announces $1,000,000 USD Decentralized Exchange Coding Competition (medium.com)","Warning: Fake emails to PayPal users with a ""cryptocurrency warning"" (self.Bitcoin)",PSA: This is the calm before the storm. (self.Bitcoin),Sierra Leone just ran the first (Bitcoin) blockchain-based election (techcrunch.com),Lightning Network visualizer now live on Mainnet (graph.lndexplorer.com),"/r/allAfter countless late nights, lines of code, bug fixes, and memes... We finally released Lightning for bitcoin mainnet!!! (twitter.com)","Over 50 Percent of Square Merchants Ready to Accept Bitcoin, Survey Shows (btcmanager.com)","Bitcoin: If you cant handle my 20% drops, You don't deserve my 600% gains. (self.Bitcoin)","LN is here!!!! How to run your Lightning Node, this is what all BTC supporters need to be doing ASAP! (medium.com)"
2018-03-17,Did you know that the current Bitcoin code is 77 thousand lines long? (self.Bitcoin),Is Bitcoin Alive? (self.Bitcoin),"BREAKING NEWS: According to the latest reports, Bitcoin doesn't give a fuck about government regulations and 2000 shitcoins gunning for it! (twitter.com)",Paypal's Warning Email To Stop Trading Crypto Has Been Proven To Be Fake. (self.Bitcoin),Google and Facebook banning cryptocurrency ads may actually be good for Bitcoin (thestreet.com),⚡️Announcing LND 0.4-beta ⚡️ (blog.lightning.engineering),"The Government Seized Nearly Everything I Owned Despite Never Being Charged With a Crime, But They Couldn't Touch My Bitcoin (ir.net)",Bitcoin Mining Costs As Much as Buying a Bitcoin These Days (fortune.com),Question about creating own Lightning Node (self.Bitcoin),1 sat/byte transaction got it's first confirmation in 3 minutes. (self.Bitcoin),MIT Bitcoin Expo 2018 Day 1 Room 2 | MIT Bitcoin Club | Live (youtu.be),"“Real Users”: In This Italian Mountain Town, Everyone Knows About Bitcoin (bitcoinmagazine.com)",Will SegWit & Lightning Network kill Alternative-Cryptocurrencies? (crypto101.org.uk),"Bitcoin Is Boring, Which Means It Might Finally Be Useful? (youtube.com)",Anyone else trying to justify buying more than their usual plan? (self.Bitcoin),"“According to all known laws of economy, there is no way..."" (self.Bitcoin)","MtGox trustee confirms he did not sell BTC at same time as moving them, also didn't affect price (self.Bitcoin)",Can we discuss this LN attack here? (np.reddit.com),World’s first Bitcoin monument erected in Slovenian city of Kranj (firstsfeed.com),"Wall St. firm that traded $5 Trillion in 2017, just started trading Bitcoins ! (businessinsider.com)",Stitching Bitcoins (streamable.com),"Please put again the Bitcoin FAQ sticky post, or at least a direct link on the side panel. This is an amazing resource for noobs! (np.reddit.com)","What happens to the overall price of a Bitcoin after all 21,000,000 have been released or collected. Also how will all the lost Bitcoin's effect things when all Bitcoin's have been acquired? (self.Bitcoin)",Any Designers Want To Collaborate On A Lightning iOS Wallet With Me? (self.Bitcoin),"/r/allAfter countless late nights, lines of code, bug fixes, and memes... We finally released Lightning for bitcoin mainnet!!! (twitter.com)",Defending bitcoin against state sponsored attacks - Andreas Antonopoulos (youtube.com),"Daily Discussion, March 17, 2018 (self.Bitcoin)"
2018-03-18,Did you know that the current Bitcoin code is 77 thousand lines long? (self.Bitcoin),"I paid Hodl Monkey 455,032 satoshi via Lightning for two t-shirts AMA (i.imgur.com)",How I feel trying to HODL bitcoin lately... (youtube.com),Paypal's Warning Email To Stop Trading Crypto Has Been Proven To Be Fake. (self.Bitcoin),⚡️Announcing LND 0.4-beta ⚡️ (blog.lightning.engineering),"FORBES - Charts shows Bitcoin at 91,000 by 2020 (google.com)",F.U.N.D.A.M.E.N.T.A.L.S beat short-term sentiments. (self.Bitcoin),What HODLing is actually like! (pbs.twimg.com),Withdrew funds from Coinbase and they have lost them. (self.Bitcoin),1 sat/byte transaction got it's first confirmation in 3 minutes. (self.Bitcoin),"My ""Beginner’s Guide to ⚡Lightning⚡ on a Raspberry Pi"" is ready for @lightning Mainnet! Build your own Bitcoin Full Node with Lightning for < $100! 👨‍🚀🛠️⚡️🚀 (github.com)",There were tipping bots on Reddit / Twitter.. where are they now? (self.Bitcoin),"Bitcoin Miners Can Now Be Charged Extra for Electricity, New York Power Authorities Say (fortune.com)","MtGox trustee confirms he did not sell BTC at same time as moving them, also didn't affect price (self.Bitcoin)",Peter Thiel is a bitcoin maximalist (m.youtube.com),Mt. Gox Trustee Who Sold $400 Million Bitcoin Denies Affecting Market Price (bitcoinist.com),/r/allMood Currently. (v.redd.it),Stitching Bitcoins (streamable.com),[Good news!] After Christmas 1st time BTC dominance back to 44% again :) (i.redd.it),"Daily Discussion, March 18, 2018 (self.Bitcoin)",Flash crash on BTCmarkets? (self.Bitcoin),Bitcoin accepted in Auckland (NZ) bar (self.Bitcoin),Wall Street Firm Jane Street Capital includes Bitcoin in Traded Assets - $13 Billion Daily! (youtube.com),Super stoked about my first mainnet lightning transaction (self.Bitcoin),PSA: use a mobile wallet like Samourai or a desktop wallet like Electrum to avoid overpaying fees. (self.Bitcoin),Defending bitcoin against state sponsored attacks - Andreas Antonopoulos (youtube.com),Lost 1 word out of 12 paper key (self.Bitcoin)
2018-03-19,MIT Bitcoin Expo 2018 - Day 2 (self.Bitcoin),US Congress Praises Cryptocurrency and Blockchain Technology (self.Bitcoin),Bitcoin Lightning Network growing faster than ever expected (youtube.com),"Daily Discussion, March 19, 2018 (self.Bitcoin)","Lightning Network: visualizing paths between two nodes (click ""new random graph"" to create new ones) (robtex.com)",The conversion of stocks to asset-based coins has begun (youtu.be),I had my transaction verified in the next block with a fee of 1 sat/B. It can’t get better than this. (self.Bitcoin),Bitcoin ATMs in Orange County (self.Bitcoin),"Today, I will defend Bitcoin in front of the Finance committee at the Canadian parliament (live) (twitter.com)",Trump Issues Action Blocking Venezuelan Government Cryptocurrencies (bloomberg.com),U.S. Congress Officially Supports Blockchain Technology (astralcrypto.com),"I am a taxi driver in Dublin, Ireland. I always offer my customers their change in Bitcoin. (self.Bitcoin)",Pay for Arcade Game using Lightning! (youtu.be),"Twitter Follows Facebook and Google, Will Ban Cryptocurrency Advertisement Ban in Two Weeks (coinjournal.net)",Congress is positive on cryptocurrency in new major economic report extensively citing Coin Center work. (coincenter.org),I run a airport shuttle bus in Australia and put a 'Bitcoin accepted here' sign in the bus. This is what most people think. (self.Bitcoin),Mastercard are open to cryptos that are government developed and backed (facepalm) (self.Bitcoin),Bitcoin investors set to outnumber stock traders in Indonesia (cryptoren.com),Exactly five years ago this bitcoin classic was created: Zhou Tonged - Holding (Billy Joel - The Longest Time) (youtube.com),"New place that accept bitcoin in Bangkok, Cocotte Restaurant in Soi Sukhumvit 39, after I travelled through Asia only paying in Bitcoin. (youtube.com)",When you HODL through a bear market (v.redd.it),8 months is how long it took for me not to obsess about the bitcoin price anymore. (self.Bitcoin),US citizens banned from buying/selling/using digital tokens issued by Venezuelan government (whitehouse.gov),LIT BOX is coming to support you using Bitcoin and any lightning enabled coin! (youtube.com),Me checking crypto market today... (v.redd.it),Bitcoin Accepted: Iowa City Area Chamber of Commerce (blog.coinninja.com),"I was telling my in-laws about why Bitcoin has so much potential for worldwide use, and my very Christian mother-in-law looked at me with a crazy look in her eye and said, “You mean like one World currency!” (self.Bitcoin)"
2018-03-20,Halong Dragonmint Saps Bitmain Mining Monopoly Days After Shipping (bitcoinist.com),PSA: Now is the time to get verified on your favorite exchange so you are not fumbling around and bitching last minute during the next ATH. (self.Bitcoin),"Episode 05: Spoons, Forks & Lawsuits | Magical Crypto Friends (youtu.be)",Kevin O'Leary: NYC hotel wants to use a $400 million cryptocoin offering to sell ownership like a stock (cnbc.com),"Billionaire Peter Thiel doubles-down on Bitcoin, calling it ""true Digital Gold"". (themerkle.com)",The most elegant aspect of Bitcoin is that it assumes that people are greedy and will act on their own self interests (self.Bitcoin),The ‘smart money’ isn’t worried about the bitcoin selloff (marketwatch.com),They said 2018 was gonna be the year of the fork. But i think its shaping up to be the year of Lightning ⚡️⚡️⚡️ (twitter.com),Could the Lightning Network become one of the most disruptive global financial technologies by the end of 2018? (coininsider.com),Congress Loves Cryptocurrency (71republic.com),"Bitcoin Price Chart Reminds Morgan Stanley of Nasdaq Tech Bubble, But Claims It’s Moving 15 Times Faster (coinjournal.net)","Today, I will defend Bitcoin in front of the Finance committee at the Canadian parliament (live) (twitter.com)",I run a bar in Sydney and we are planning on hosting a monthly Bitcoin/Crypto meetup (self.Bitcoin),Think its really cool that this girl is travelling the world by paying without cash but BITCOIN only! I wasnt aware that this is even possible. (youtube.com),"The NSA Worked to “Track Down” Bitcoin Users, Snowden Documents Reveal (theintercept.com)",(Forbes) How To Prepare Your Business For The Age Of Stable Bitcoin! (forbes.com),Breaking the Ledger Security Model (saleemrashid.com),A picture of our garage - A „thank you“ for everything that Bitcoin teached me and gave me! (i.redd.it),G20 Confirms There Is No Need to Regulate Cryptocurrencies as of Right Now (themerkle.com),[Discussion] Liechtenstein citizens now able to buy Crypto directly from the banks. I know its a small country but will other country's make movements like this one? Comment why or why not :) (cryptos.com),Firmware 1.4: deep dive into security fixes - Ledger (ledger.fr),Let's Talk About The Google Crypto Ban (localcoinatm.com),"Daily Discussion, March 20, 2018 (self.Bitcoin)","Tails is organizing a donation campaign, but unfortunately you can't donate BTC. Shame. (twitter.com)",Hi have done a fully automated Bitcoin Core and LND 0.4 installation bash script for Raspberry Pi. (github.com),MIT Bitcoin Expo 2018 - Day 2 (self.Bitcoin),
2018-03-21,New Chinese Central Bank Governor Bullish On Bitcoin and Cryptocurrencies. (self.Bitcoin),"The transaction of 195,000 BTC took place on November 11, 2013. $100 million sent, cleared in seconds with $0.00 fees. Technologies with vastly higher efficiencies eliminate the established, inefficient ones. Always have, always will. (twitter.com)",It's over 9000! (youtu.be),Twitter CEO Dorsey Believes Bitcoin Will become the World’s Single Currency in 10 Years (coinjournal.net),“Bitcoin will overtake the dollar in importance as it becomes the single global currency of the internet within a decade” (twitter.com),Jack Dorsey expects bitcoin to become the world's 'single currency' in about 10 years (cnbc.com),I created a newsmap for crypto news. You can visually see the entire crypto landscape in just one glance. (cryptocontrol.io),"PSA - If you haven't done your taxes yet, get to it. You might be shocked by the results if you're like me. (self.Bitcoin)",The girl who travelled and paid using Bitcoin (blockmanity.com),The Central Bank Bubble: It Will Be Ugly (goldtelegraph.com),"Bitcoin will become the world’s single currency, tech chief says (thetimes.co.uk)",r/CryptoCurrency just recently added a few new rules which I think are fundamentally sound. I'd like to make the suggestion that r/Bitcoin ought to do the same. (self.Bitcoin),There is now 1.000.000 of US debt for every bitcoin that will ever be mined. (usdebtclock.org),OFAC (Office of Foreign Assets Control) might blacklist Bitcoin addresses of people/governments they want to sanction (treasury.gov),"Newly appointed China's central bank head Yi Gang: ""Bitcoin is a currency that provides freedom to anyone that uses it."" (twitter.com)","""Bitcoin will be the single global currency of the internet,"" says founder of Twitter & Square (twitter.com)",/r/DarkNetMarkets/ banned by reddit (reddit.com),"No, there isn't child porn on the bitcoin blockchain (news.bitcoin.com)",Shitpay (Bitpay) adopted BIP70. BIP70 introduces the requirement on developers to support legacy public-key infrastructure dependencies with known track records of vulnerabilities Additionally AML/KYC surveillance and monitoring of on-chain transactions and more effective blacklists. (blog.samouraiwallet.com),"TIL: You can officially get the Bitcoin reference book ""Mastering Bitcoin"" as an ebook (pdf) for free (conferences.oreilly.com)",Here is a quick video of what life is like in Venezuela! (Use Bitcoin!) (twitter.com),"Daily Discussion, March 21, 2018 (self.Bitcoin)","Alt-coin bear market is over, but bitcoin is still the best bet: Wall Street's Tom Lee (cnbc.com)",TREZOR One: Firmware Update 1.6.1 (blog.trezor.io),Apartment building caught fire - friendly reminder to make BACKUPS of your keys/seeds! (self.Bitcoin),Citibank closed my account after 32 years! (self.Bitcoin),MIT Bitcoin Expo 2018 - Day 2 (self.Bitcoin)
2018-03-22,Adoption : Here's an updated list of 100 companies that are accepting Bitcoin payments (unblock.net),'I sold too early' and 'I didn't buy enough' are 2 phrases I hear all too commonly regarding Bitcoin. (self.Bitcoin),I wonder if this girl is using Bitcoin today... (youtu.be),Bitcoin Drops As Markets React To Fake Japan Binance FUD (bitcoinist.com),UK Government is Looking into Cryptocurrencies with New Task Force (coinjournal.net),Brief explainer for beginners: the different implementations of the Lightning Network (and what does it mean it's in beta?) (self.Bitcoin),Thomas Lee Presents The Economics of Cryptocurrencies | Upfront Summit 2018 (youtube.com),RSK sidechain is operational on mainnet and Jaxx smartphone wallet supports it. Why is this not hands down the main headline here? Did I miss anything? (self.Bitcoin),Found this chart showing how long you had to HODL to double your money in $BTC in the last 7 years. The median is 189 days. (twitter.com),Younger Americans are certainly the most enthusiastic about cryptocurrency! (bostonglobe.com),/r/allDutch court: Bitcoin is an official financial asset. (uitspraken.rechtspraak.nl),HODL for sure... but spend every chance you get. (self.Bitcoin),Blockchain Technology with Andreas M. Antonopoulos (Part 2) - Case interview (case-podcast.org),Lightning Network is the Future of Bitcoin (medium.com),We are in a black swan environment. Centuries old wealth will be turned upside down. Take your advantage. Position your clan for the next empire. (twitter.com),"The newly appointed head of China's Central Bank just said ""Bitcoin is a currency that provides freedom to anyone that uses it."" (translate.google.co.uk)",Money in the Bank is not your Money. (twitter.com),If Cryptocurrencies like Bitcoin are supposed to be an alternative form of currency then why do people treat it like a stock and sell it for cash? Isn’t it acting more like an asset than it’s own currency? (self.Bitcoin),"Daily Discussion, March 22, 2018 (self.Bitcoin)",BREAKING: there is a pornographic image hidden in the mathematical constant Pi! Call your representative and demand a ban! (self.Bitcoin),FileBazaar Joins the Lightning Charge Lapps (blockstream.com),Overstock.com's CEO Wants To Undermine Wall Street With The Tech Behind Bitcoin (HBO) (youtube.com),College students are using student loans to invest in bitcoin (bostonglobe.com),Nearly 8% of US citizens plan on buying crypto in the future. (coininsider.com),"For the first time, NYC buyers pay for condos in bitcoin (nypost.com)",MIT Bitcoin Expo 2018 - Day 2 (self.Bitcoin),
2018-03-23,REMEMBER: There will NEVER be enough BTC for all of today's existing millionaires to own just ONE. (self.Bitcoin),Yahoo Japan To Build Its Own Crypto-Asset Exchange (cryptoglobe.com),Stolen Bitcoin Tracing - Computerphile (youtube.com),Hashrate Exploding ; Bitcoin Mining Driving Decentralized Energy Production (self.Bitcoin),"Daily Discussion, March 23, 2018 (self.Bitcoin)",No matter how many times bitcoin falls he crawl he's way back (v.redd.it),"""Printing money has successfully destroyed the middle class. Central Banks around the world have distorted all asset prices. Income inequality has skyrocketed, as savers are punished and the rich continue to play monopoly with the Fed!"" <- Bitcoin FTW (twitter.com)",RSK sidechain is operational on mainnet and Jaxx smartphone wallet supports it. Why is this not hands down the main headline here? Did I miss anything? (self.Bitcoin),Bitcoin Knots v0.16.0.knots20180322 released (bitcoinknots.org),Malta snaps up largest crypto exchange Binance (bloomberg.com),Younger Americans are certainly the most enthusiastic about cryptocurrency! (bostonglobe.com),"Malta's prime minister is personally welcoming cryptocurrency exchange Binance to the country. Finally, crypto exchanges are getting proper support and banking services. (twitter.com)",/r/allDutch court: Bitcoin is an official financial asset. (uitspraken.rechtspraak.nl),Africa's young professionals embracing 'gospel of bitcoin' (abcnews.go.com),"Yahoo Japan to Launch Cryptocurrency Exchange in 2018, Says Report (coindesk.com)","SEC is to Examine Up to 100 Hedge Funds Focused on Cryptocurrencies, WSJ Reports (coinjournal.net)",The World's Biggest Crypto Exchange Is Heading to Malta (bloomberg.com),"South Korea's Second Largest Crypto Exchange Upbit Launched the Country's First Crypto Index, Which Could Fuel Adoption by Helping Beginner Investors (newsbtc.com)",Seen at my university (i.redd.it),"We've just announced Filebazaar—the first of seven new Lightning apps (""Lapps"") that we'll be announcing over the next week. (twitter.com)",College students are using student loans to invest in bitcoin (bostonglobe.com),BREAKING: there is a pornographic image hidden in the mathematical constant Pi! Call your representative and demand a ban! (self.Bitcoin),how i feel after reading an altcoin whitepaper (youtube.com),20 Asian banks launching Blockchain conglomerate by 2019; Savings? in Tens of Billions of Dollars. (tropyc.co),Lightning Network *MAINNET* has > 1000 nodes. 2079 channels. IT'S HAPPENING!!! (graph.lndexplorer.com),Are Central Banks About to Open The Floodgates For Gold and Cryptocurrency? - Central Banks could soon start buying bitcoin to hold on balance sheet! (goldtelegraph.com),
