2018-03-05,Electrum 3.1 released today (twitter.com),"Back in 2013, a single subway sandwich shop accepting Bitcoin got airtime on CNBC, and we were all jumping for joy. Nowadays we get full TV features about Bitcoin and people are like "" yawn, could be better"". (cnbc.com)",How last week's high court ruling could spark Israeli Bitcoin Mania (jpost.com),Germany has finally a Minister of State for Bitcoins and MEMEs (Dorothee Bär is from today Ministry of digital things) (twitter.com),Iceland police arrest suspected Bitcoin server thieves (bbc.co.uk),Social Attacks on Decentralization - Alyse Killeen (Breaking Bitcoin 2017) (youtu.be),"Bitcoin Transaction Volume Decreases With Batching, Not Due to Lack of Demand (newsbtc.com)",North Korea uses bitcoin hauls to dilute sanctions impact -- Report says it could have made $200 million (self.Bitcoin),Oracle going big on Blockchain? (eventreg.oracle.com),JP Morgan on blockchain adoption timeline for financial institutions and managers (jpmorgan.com),What options are there for Bitcoin debit cards at the moment? (self.Bitcoin),Venezuela Orders Government Services to Accept Any Cryptocurrency (twitter.com),Electrum 3.1 to be released today (twitter.com),Another big step towards mainstream adoption: PayPal patenting a system for faster cryptocurrency transaction times (captainaltcoin.com),Coinbase Hit by Lawsuit Over Alleged Insider Trading (finance.yahoo.com),"""Anonymous bitcoin donor rains $56 million on stunned nonprofits"" (story about The Pinapple Fund) (philanthropy.com)",24-Year-Old Jailed for Selling Bitcoin Without Asking for ID (everycryptonews.com),"If you get arrested for selling bitcoins, please sent an email to fight@AbolishTheBitlicense.org (self.Bitcoin)",Nice article about the state of blockchain tech and crypto in general: Blockchain - Between The Hype and Reality (bitemycoin.com),Cryptocurrency is officially a word according to Merriam-Webster. (merriam-webster.com),"Daily Discussion, March 05, 2018 (self.Bitcoin)","""Chain fees leave a bad impression vs inflation. Fees are visible, inflation is hidden. People get the impression that fees must be minimized, but the system is designed around them. Fees remind people of middleman rent, but it's actually a direct support for the system's security"" (twitter.com)","Bloomberg: Square, Inc. to possibly facilitate Bitcoin (bloomberg.com)",Czech Republic and bitcoin: republic’s way to becoming the largest crypto hub in Europe (prague.bc.events),Chinese Giant Alibaba Leveraging Blockchain For Shipment Logics (btcnn.com),Member Of China’s Main Political Advisory Proposes National Crypto Trading Platform (bitcom.blog),"Shapeshift now batching, $1 TX fees. (twitter.com)"
2018-03-06,[ UBUNTU PPA UPDATED ] Bitcoin Core 0.16.0 now available! (launchpad.net),GMO Has Mined Millions of Dollars in Bitcoin Already (coindesk.com),Do you buy goods and services with Bitcoin? Or do you Sell your Bitcoin for goods and Services. (self.Bitcoin),Social Attacks on Decentralization - Alyse Killeen (Breaking Bitcoin 2017) (youtu.be),"On 6-7 of June, London will host the largest blockchain gathering in Europe – Blockchain International Show (bisshow.com)",Bitcoin Rises Above 50-Day Average for First Time Since January (bloomberg.com),Georgia now Considering Bitcoin Tax Payments (crypsign.com),Bitcoin on the TTC subway. #mainstream (i.redd.it),Not scaling but insufficient privacy is the biggest threat for Bitcoin; must be solved in the base layer - Andreas Antonopoulos (youtu.be),Venezuela Orders Government Services to Accept Any Cryptocurrency (twitter.com),"How much USD would need to flow into BTC to move the BTC ""market cap"" to 1 Trillion USD? (approx $60,000 per BTC) (self.Bitcoin)",Survey of Gamers Suggests Strong Ownership of and Interest in Using Cryptocurrency Across Game Worlds (nwn.blogs.com),Bitcoin user adoption is currently at 0.95%. You are still part of the Innovator phase if you invested in Bitcoin (twitter.com),Wuille Art (up.picr.de),Odds of winning Powerball (Lottery) vs guessing one bitcoin private key (by @Coinguybri) (i.redd.it),"""Consumers used bitcoin on merchant services for a monthly average of $190.2 million in 2017"" - 2.3 billion per year?! Much more than I expected! (cnbc.com)","""Anonymous bitcoin donor rains $56 million on stunned nonprofits"" (story about The Pinapple Fund) (philanthropy.com)",24-Year-Old Jailed for Selling Bitcoin Without Asking for ID (everycryptonews.com),"If you get arrested for selling bitcoins, please sent an email to fight@AbolishTheBitlicense.org (self.Bitcoin)",Cryptocurrency is officially a word according to Merriam-Webster. (merriam-webster.com),Me every time people argue about Bitcoin being a scam (youtube.com),Degussa in Zurich and Geneva recently accepted cryptocurrencies when buying precious metals - (www.finews.ch) (translate.google.ch),"Bitcoin Adoption: Segwit, Cheap, and Fast! (youtube.com)","Bitcoin more likely to crash to $100 than see crazy growth - former IMF Chief Economist. But when you read his logic behind it, no place for FUD, as he obviously doesn't understand crypto (captainaltcoin.com)",New Ledger Nano S firmware 1.4: install up to 18 apps on the device! (ledger.fr),"Shapeshift now batching, $1 TX fees. (twitter.com)","Daily Discussion, March 06, 2018 (self.Bitcoin)"
2018-03-07,People think volume is down with bitcoin when its segwit batching. (self.Bitcoin),Tim Draper predicts hyperbitcoinization within 5 years (twitter.com),Social Attacks on Decentralization - Alyse Killeen (Breaking Bitcoin 2017) (youtu.be),An Open Letter to Banks about Bitcoin and Cryptocurrencies (medium.com),35 000 BTC of the 200k mtgoxbtc were sold over the last three months! (mtgox.com),Mt. Gox's trustee announces he sold $360m of Bitcoin over the past 6 months (twitter.com),"Ex-President Of Mexico, Vincente Fox Speaks On His Support Of Cryptocurrency (youtu.be)","Daily Discussion, March 07, 2018 (self.Bitcoin)","Breadwallet, shame on you! No available time to segwit, but enough time to shitcoins. (livebitcoinnews.com)",Coinbase Announces Index Fund for Accredited Investors (self.Bitcoin),Putin's Orders: Russia Prepares to Legalize Cryptocurrency Markets (ccn.com),Slush Pool is Now Compatible With AsicBoost Bitcoin Miners (bitcoinmagazine.com),Coinbase Index Fund: The Dow Jones of cryptocurrency exchanges (trustedreviews.com),"Look at this, Twitter suspended my account permanently for talking/warning people about the scammers, this happened at the same time Kraken Support had their account permanently suspended... Please help me get my Twitter back, I put so many hours into it... FYI Twitter is the scammers (i.imgur.com)","Big Travel Site in S.Korea with Over 50,000 Hotels to Accept Payments in Bitcoin and other cryptocurrencies (captainaltcoin.com)",First US Credit Card with Bitcoin Rewards (blockrize.com),US Judge Rules Cryptocurrencies Are Commodities in CFTC Case (coindesk.com),Jihad Wu (Bitmain CEO) will turn in his grave: DragonMint Bitcoin miner implements “version-rolling” AsicBoost (halongmining.com),Japanese Whale Controls $2.3 Billion Worth of Bitcoin (coindaily.co),"‘That’s why they were so against SegWit. SegWit blocks covert but not overt AsicBoost, exposing Bitmain and forcing them to join BDPL’ - Charlie Lee (twitter.com)","Why Blockchain Is Booming In Liechtenstein, The Sixth Smallest Country In The World (forbes.com)","UK Company Linked to the Theft of 650,000 Bitcoins from Mt Gox (coinjournal.net)",It's liberating when you realize that no one actually has a clue what they're talking about regarding this market. (self.Bitcoin),GTA Online poking fun at Cryptocurrencies in one of their latest DLC missions never fails to make me laugh. (v.redd.it),cobra-bitcoin must step down asap from Bitcoin.org. He is Jihan's Wu propaganda tool. (twitter.com),New Ledger Nano S firmware 1.4: install up to 18 apps on the device! (ledger.fr),"@Bitcoin Twitter page is restricted, why Roger? (i.redd.it)"
2018-03-08,The market is waiting for the other shoe to drop but it's not going to drop. (self.Bitcoin),International Women’s Day : The Women Shaping Cryptocurrency (coinjournal.net),TD Ameritrade Said Millennials Are Excited About Two Things: Bitcoin and Cannabis (cryptoblockchainresearch.com),It's Over 9000!!! - Time for MEME support! (youtube.com),Arizona Advances Groundbreaking Bill to Accept Bitcoin for Taxes (dailyhodl.com),"Someone self-represented in arbitration, claimed $107,238 and beat Coinbase. Anyone know who it is? (levelplayingfield.io)",Market crashes being caused by Mt Gox trustee is possibly the most bullish news we've ever encountered (self.Bitcoin),"$USD has lost nearly 95% of its value since its creation. #Bitcoin has gained 8,934,999,900% since its creation. #BuyBitcoin #HODL (twitter.com)",Where the hell is the 'roller coaster guy' ? (self.Bitcoin),"Don't expect BTC to jump right back up, but HODL (self.Bitcoin)","Daily Discussion, March 08, 2018 (self.Bitcoin)",So Yeah This Happened .. (v.redd.it),Why is a lawyer trading my stolen Bitcoin? (self.Bitcoin),The real wealth transfer from bitcoin comes at the flat end part of the adoption S-curve when Hodler's use their BTC to purchase productive capital assets and then earn BTC with them. (self.Bitcoin),"""Fiat users will get mocked 5 years from now..."" -Tim Draper (cryptovest.com)",Mtgox caused 2013 and 2018 crash (self.Bitcoin),Got scammed out of 70K... is there anything I can do? (self.Bitcoin),"Bitcoin, Like Email, Will Become a Basic Utility (decentralize.today)",We now accept Bitcoin Lightning Payments on mainnet! (self.Bitcoin),Binance Thwarts ‘Large Scale’ Theft Attempt That Sees Hackers Lose Their Funds (cryptoglobe.com),Maybe I'm slow - but isn't the fact that this dip is only caused by dumping and a bit of panic selling a good thing in the end? (self.Bitcoin),List of Open Lnd Issues Suitable for Beginners (github.com),MTGOX REMEMBER! Not your keys? Not your Bitcoin. Featuring Andreas Antonopoulos (youtube.com),Sierra Leone Secretly Holds First Blockchain-Powered Presidential Vote (coindesk.com),Binance Claims Hackers Lost Money in Stealing Attempt (cryptovest.com),Dear Mt. Gox Trustee: Please market sell the remaining 160K BTC in your custody immediately. I am ready to buy. (self.Bitcoin),
2018-03-09,Lost 4.0 BTC with an old wallet (self.Bitcoin),Things will get real interesting when Bitcoin's inflation rate is below that of Gold! ~815 days until the next halvening Price volatility is a distraction from the longer term trends ... (twitter.com),Epic Fail! Fake @bitcoin twitter account fails even to their own propaganda polls :P (i.redd.it),"Daily Discussion, March 09, 2018 (self.Bitcoin)",Bitcoin Core 0.16.0 – Full Segwit capabilities are here. (coinjournal.net),Fun fact: 20% of the world's population is younger than Bitcoin (self.Bitcoin),TD Ameritrade Said Millennials Are Excited About Two Things: Bitcoin and Cannabis (cryptoblockchainresearch.com),"Bitcoin - so simple... haha, hilarious! (youtube.com)",I made a website out of Bitcoin Core help command. I hope it is helpful to someone (bitcoin-rpc.github.io),Go tell a Hodler passers-by that here by Mt Gox prices lie. (self.Bitcoin),Just invested $500 into Bitcoin (self.Bitcoin),A full explanation of how Keys & Addresses work. (see comment) (youtube.com),So Yeah This Happened .. (v.redd.it),[Breaking News] Wyoming lawmakers say cryptocurrency tokens exempted from securities laws (self.Bitcoin),Bitfinex - Introducing 'The Honey Framework' (medium.com),Debt to GDP Ratio over 100% worldwide (self.Bitcoin),Conversation I had with my friend (self.Bitcoin),Got scammed out of 70K... is there anything I can do? (self.Bitcoin),China's Bank Governor Admits Cash Might Go Extinct (btcnn.com),The Bitcoin Hotel for Entrepreneurs (btcmanager.com),PSA: MtGox Cold Wallet watch script created to monitor moves (gaelb.alwaysdata.net),"Mtgox is the best news this year, so why are people panicking? (self.Bitcoin)",Reminder of what Bitcoin is to me (self.Bitcoin),Square's share price is skyrocketing as it embraces Bitcoin and breaks into banking (qz.com),"I built this tool crypto360.io because I was tired of going through all Bitcoin news sites. I listened to feedback and looking to see if people would actually use this daily. (Sentimental analysis, Social trends, Real-time coin tracker, twitter/Reddit feed, Charts,etc.) - Desktop Only (dashboard.crypto360.io)","Our cryptocurrency events calendar is finally COMPLETE! Let us know what you think, it was your feedback that prompted us to build it in the first place, so thank-you. (coinloop.io)",
2018-03-10,SatoshiLabs sent me a new Trezor with the picture I ordered! (i.redd.it),/r/allEpic Fail! Fake @bitcoin twitter account fails even to their own propaganda polls :P (i.redd.it),"Daily Discussion, March 10, 2018 (self.Bitcoin)","Hate Bit Pay and their lies? Try BTC Pay - the open source solution, no intermediaries (reddit.com)",BMI (The Bitcoin Misery Index) Is Flashing A Buy Signal (forbes.com),Who would imagine that mining cryptocurrencies and agriculture can work together? The first batch of cryptomatoes is ready to be harvested. We are using the excess heat for the tomato greenhouse and it is working:-) (twitter.com),"Bitcoin Core's source code is now being timestamped with Bitcoin itself, via OpenTimestamps (twitter.com)",Tipped the pizza guy with Bitcoin! (self.Bitcoin),One of the biggest IT companies in the world (Mail.Ru Group) is accepting Bitcoin (self.Bitcoin),Mining Crypto In a Browser Is a Complete Waste of Time. (techaed.com),"Bullish AF: ""South Korea’s Kakao to Integrate Cryptocurrency For 12,000 Merchants & Millions Users""!!! (ccn.com)",Andreas Antonopoulos : Bitcoin is the next Bitcoin (youtube.com),US Senate deliberating bill to Audit the Federal Reserve (marketwatch.com),Study shows young Romanians prefer using cryptocurrencies like bitcoin for payments as oppose to fiat money (bitguru.co.uk),This space heater mines bitcoin while keeping your house warm (mashable.com),Georgia Looks To Join Arizona In Accepting Crypto For Tax Payment. (stopthefud.wordpress.com),Hate Bitcoin? This might change your mind (medium.com),"[GUIDE]: Samourai + Full node. Don't trust, verify. (youtu.be)","LMAO: Silencing contributors - Purest form of censorship at bitcoin,com!!! (twitter.com)","$3b of all daily volume is fake, OKex main offender (again) (medium.com)",Me every time I trade Bitcoin (v.redd.it),"Bitcoin statue (Kranj, Slovenia) (i.redd.it)",Aloha from Hawaii My friend makes bomb ass hot sauce and I convinced him to accept Bitcoin. Spicy Ninja Sauce is down with the crypto!! (spicyninjasauce.com),"Peter Todd about Bitpay's ""network fees"": ""IMO this is form of fraud, no different from how phone companies have been smacked down for adding fake charges to your phone bills."" (twitter.com)",BitPay in damage control over outrage about their so called “network” fee for Bitcoin. (v.redd.it),Bank of Montreal Canada (BMO) has blocked all cryptocurrency transactions effective March 1st (self.Bitcoin),
2018-03-11,"Daily Discussion, March 11, 2018 (self.Bitcoin)","Boycott Coinmarketcap, they listed a dozen fake cloned exchanges that comprised a major part of the volume. Okex & Huobi also 80-90% fake. (twitter.com)",Using Bitcoin to help others in need ... Today is a great day (self.Bitcoin),Blockchain at UC Berkeley to expand its Bitcoin courses worldwide! (ebitnews.com),"Taking Down Bitcoin - we talk about the ""51% Attack"" on our crypto podcast (cryptopulse.co.uk)",Cashing out of Coinbase - what options? (self.Bitcoin),"To all the people disappointed with their investment (in bitcoin) performance. Please do as a favor, cut your losses short and spare us the nagging about bubbles and all the negatives you clearly see now (but couldn't see when the price was going up) (self.Bitcoin)","Hate Bit Pay and their lies? Try BTC Pay - the open source solution, no intermediaries (reddit.com)",Banks want to kill Bitcoin. Wealthy want to kill Bitcoin. Economists want to kill Bitcoin. Governments want to kill Bitcoin. They’ll all learn you can’t kill Bitcoin. (twitter.com),Who would imagine that mining cryptocurrencies and agriculture can work together? The first batch of cryptomatoes is ready to be harvested. We are using the excess heat for the tomato greenhouse and it is working:-) (twitter.com),"Bitcoin Core's source code is now being timestamped with Bitcoin itself, via OpenTimestamps (twitter.com)",Tipped the pizza guy with Bitcoin! (self.Bitcoin),Uk exchange (self.Bitcoin),"Bullish AF: ""South Korea’s Kakao to Integrate Cryptocurrency For 12,000 Merchants & Millions Users""!!! (ccn.com)",Andreas Antonopoulos : Bitcoin is the next Bitcoin (youtube.com),PBoC Chief Says Cash Might Become Obsolete As Digital Payments Evolve (worldcoinindex.com),Bitcoin Bank: Finnish Crypto Services Provider Prasos Loses 4 of 5 Banks (darkwebguide.net),Bitcoin Auction: Nearly $20 Million Headed For U.S Government Coffers (cryptocoinspy.com),We integrated Lightning Payments to our Art Store (ludvigart.com) via @Blockstream's Lightning Charge! We are very excited to be the first art gallery/store to support LN! (twitter.com),Started using Bisq decentralized exchange. Great experience. (self.Bitcoin),"Why Bitcoin is the Petroleum of our day, great article written by Tuur Demeester in 2014 but still very relevant. (medium.com)","Peter Todd about Bitpay's ""network fees"": ""IMO this is form of fraud, no different from how phone companies have been smacked down for adding fake charges to your phone bills."" (twitter.com)","It's over 9000! - Nostalgia trip for ""veterans"" who bought before December (youtube.com)","Did you know? For McAfee to win his bet, BTC only needs to be $ 7,000 today (self.Bitcoin)",Bank of Montreal Canada (BMO) has blocked all cryptocurrency transactions effective March 1st (self.Bitcoin),Charlie Lee - Sydney Meet Up Details (nuggets-news-charlie-lee.eventbrite.com.au),
2018-03-12,F2Pool now mining all transactions (self.Bitcoin),Dominos pizza in germany accepts bitcoin payments [03.12.2018] (self.Bitcoin),"Daily Discussion, March 12, 2018 (self.Bitcoin)",Bitcoin Godzilla vs King Kong Banker - Custom poster we made for the CoinFest event in the UK (i.redd.it),Trying to invest (i.redd.it),Investors bullish on Bitcoin now that the 'Tokyo Whale' has stopped selling (cnbc.com),"Bitcoin is the first hyperdeflation in history. We are injecting trust into a currency regulated by an algorithm, because we have not had the best track record with currencies regulated by men. (cryptoresearch.report)","After 36 days, my Gemini account was finally verified. Bought my first BTC. See ya at the Lambo dealership. (self.Bitcoin)",I love paying with bitcoin. (self.Bitcoin),"Bitcoin Popularity Surges in South Africa Amid Political, Economic Turmoil (bitcoinist.com)",Last Week Tonight with John Oliver: Bitcoin segment (March 11th 2018) (youtube.com),/r/allThe latecomer’s BTC journey (v.redd.it),"Time for confirmation for Bitcoin is very quick, and fees are low, the experience of traveling using only bitcoin in Hong Kong went nearly smoothly. BITCOIN IS NOT ONLY AN ASSET (youtube.com)",Lightning Network Mainnet Passes 1000 Nodes as Release 'Nears' (bitcoinist.com),"This roundabout was just unveiled in Kranj, Slovenia (i.redd.it)",Did Coinbase ever fully implement Segwit? (self.Bitcoin),Tonight's episode of John Oliver's Last Week Tonight will discuss blockchain and cryptocurrencies (twitter.com),I built a stateless (no database) blockchain explorer to run alongside my BTC node. It's open source and I hope it's useful to others who enjoy running their own nodes. (self.Bitcoin),Show some love to Dan Gurewitch (the man likely behind most of the John Oliver piece) (self.Bitcoin),"If anyone is having a bad day with crypto's market, Remember that today in 1976 Roland Wayne sold his 10% stake in APPLE for $800. Now it's worth $58,065,210,000 (self.Bitcoin)",This hypnotist charges half a Bitcoin for helping you remember your lost cryptocurrency password (cnbc.com),We should support Linux over Microsoft (self.Bitcoin),Segwit finally implemented on Coinbase! (i.redd.it),Fees are bellow 5 sat/byte Stop pay more! (coinb.in),"New Zero Knowledge Proof by Pieter Wuille, Andrew Poelstra, and Benedikt Bünz (soundcloud.com)","PSA: ""Bitcoin Core"" is not a cryptocurrency (self.Bitcoin)",
2018-03-13,"Daily Discussion, March 12, 2018 (self.Bitcoin)","Facebook locked up my advertising account with a balance just because it mentions ""Bitcoin, Cryptocurrency"" - need help with getting my money out and telling them to fuck off (self.Bitcoin)",Investors bullish on Bitcoin now that the 'Tokyo Whale' has stopped selling (cnbc.com),When a shitcoin 10x (v.redd.it),"Bitcoin is the first hyperdeflation in history. We are injecting trust into a currency regulated by an algorithm, because we have not had the best track record with currencies regulated by men. (cryptoresearch.report)",I love paying with bitcoin. (self.Bitcoin),The Bitcoin Fever is Taking Square's Stocks to the Moon (btcmanager.com),"Just a reminder to stay Decentralized. Bitcoin/Crypto isn't just a Currency, it's the Revolution you didn't know we needed (globalresearch.ca)","Daily Discussion, March 13, 2018 (self.Bitcoin)",Mempool being spammed again? (self.Bitcoin),SegWit is coming to BreadWallet (np.reddit.com),One of the 1st talks of Andreas A. at Jefferson Club Dinner Meetup - great introduction for himself. Noobs you should watch this! (youtu.be),ACLU sues TSA over electronic device searches (aclunc.org),"This roundabout was just unveiled in Kranj, Slovenia (i.redd.it)",Brazil’s largest Bitcoin exchange has been down for 72 hours. R$ 1 million in duplicate transactions being investigated (crypto.bi),You bought them because you like them... (youtube.com),How to adequately protect my Bitcoin wallet seed? (self.Bitcoin),Coinbase allegedly did not implement SegWit properly and is losing people's bitcoins (twitter.com),"If anyone is having a bad day with crypto's market, Remember that today in 1976 Roland Wayne sold his 10% stake in APPLE for $800. Now it's worth $58,065,210,000 (self.Bitcoin)",This hypnotist charges half a Bitcoin for helping you remember your lost cryptocurrency password (cnbc.com),We should support Linux over Microsoft (self.Bitcoin),Over 5.8 trillion in USD has been transferred using bitcoin... And people still try to say blockchain's killer app isn't already here. (twitter.com),How to sell Bitcoin to your friends (v.redd.it),This is how much banks fear Bitcoin. The battle of the planetary society versus the giants has barely started. (youtube.com),We are in the cleansing phase of crypto - where the alts that should never have had high value are steadily bleeding out. This cleansing is a necessary step to enable the next step up for Bitcoin. (self.Bitcoin),World’s First Bitcoin Monument Unveiled in Slovenia (bitcoinist.com),Japan's Third-Largest Electric Provider Is Testing Bitcoin On Lightning (coindesk.com)
2018-03-14,"The Liquid Release Candidate Network is ready! Liquid offers traders the opportunity to rapidly, securely, and confidentially move bitcoins between member exchanges, with a transaction finality of less than 2 minutes using Confidential Transactions (twitter.com)","Bloomberg: Bitcoin's Anarchy Is a Feature, Not a Bug (bloomberg.com)",Getting fed up with these FUD Headlines. (express.co.uk),Bitcoin wins over small business looking to cut credit card fees (foxbusiness.com),60% of Square Merchants Polled Willing to Accept Bitcoin (blog.coinninja.com),Bitcoin Mining Firm Bitmain Made $3 to $4 Billion in 2017 Profits (fortune.com),Playboy to start accepting crypto payments (fortune.com),"Square's Merchants Are Willing to Accept Bitcoin, Survey Says (bloomberg.com)",Google to Ban Ads for Cryptocurrencies (wsj.com),Just wow... Seriously listen to the way he speaks about Bitcoin and Cryptocurrency in general. (youtu.be),Scammed by Bitmain? Here is some info about How to Sue Chinese Companies and try to get your Bitcoins back (bitcoinmoneynews.com),BREAKING NEWS: “It will go down or up” (i.redd.it),"Daily Discussion, March 14, 2018 (self.Bitcoin)",Coinbase Receives E-Money License from UK Financial Regulator (coindesk.com),if you can sue it - it is not decentralized (twitter.com),Playboy TV to Accept Crypto Payments for Adult Content (coindesk.com),Congressman Tom Emmer: Right now this system gives advantage to the individual and not to the government. I am worried about giving the advantage to the government and taking away liberty from the individual. (twitter.com),"Fake Satoshi's lawyers tried to get A. Antonopoulos to verify their client is ""real"" and wanted Andreas to sign a NDA. (self.Bitcoin)",Sir Richard Branson and Cryptocurrency - Blockchain Is an ‘Economic Revolution’ (youtube.com),"PSA: Lately there's been a lot of ""hate this/boycott that"" company on r/bitcoin. The cultism and fanaticism mentality of ""us against them"" belongs on a different subreddit. Let's keep it that way. (self.Bitcoin)",Google ban on crypto ads a positive for Bitcoin (blog.coinninja.com),"With Millenials and Generation Z more likely to use cryptocurrency, it is time to adopt it and secure growth and success for the future! (cryptocoinspace.net)",Over three million bitcoin addresses consolidated (self.Bitcoin),Winklevoss Twins Propose Self-Regulatory Organisation to Monitor Crypto Market (coinjournal.net),[Analysis] Every major Wall Street bank has quietly invested in Crypto and DLT companies (diarweekly.com),"New Zero Knowledge Proof by Pieter Wuille, Andrew Poelstra, and Benedikt Bünz (soundcloud.com)",Circle Rolls Out Cryptocurrency Investing App to 46 US States (ccn.com)
